index,school,city,threshold,address,city_clean,threshold_idx,RSPO,match_score,matched_nazwa,nazwa_szkoły,miejscowosc,PPP_mean,O_zdawalnosc,match_key,organ_prowadzacy,wojewodztwo,liczba_uczniow,miejscowosc_rspo,nazwa_rspo,specyfika,diff_polski_zdawalnosc,abs_diff_polski_zdawalnosc,expected_PPP,threshold_discrepancy,abs_threshold_discrepancy
23,Europejskie Liceum Ogólnokształcące we Wrocławiu,Wroclaw,57.625,Wrocław ul. Marszowicka 150 54-078,Wrocław,23,21328,80,"ZAOCZNE LICEUM OGÓLNOKSZTAŁCĄCE ""COSINUS"" WE WROCŁAWIU","ZAOCZNE LICEUM OGÓLNOKSZTAŁCĄCE ""COSINUS"" WE WROCŁAWIU",Wrocław,42.494222750000006,32.61682243,"zaoczne liceum ogólnokształcące ""cosinus"" we wrocławiu",Fundacje,DOLNOŚLĄSKIE,1145.0,Wrocław-Krzyki,"ZAOCZNE LICEUM OGÓLNOKSZTAŁCĄCE ""COSINUS"" WE WROCŁAWIU",ogólnodostępny,9.877400320000007,9.877400320000007,54.336631321779116,-11.84240857177911,11.84240857177911
397,XXXVII Liceum Ogólnokształcące Z Oddziałami Terapeutycznymi,Poznaniu,27.95,ul. Klaudyny Potockiej 38 60-521 Poznań Grunwald,Poznań,397,133672,100,XXXVII LICEUM OGÓLNOKSZTAŁCĄCE Z ODDZIAŁAMI TERAPEUTYCZNYMI,XXXVII LICEUM OGÓLNOKSZTAŁCĄCE Z ODDZIAŁAMI TERAPEUTYCZNYMI,Poznań,38.48626919666666,32.769360266666666,xxxvii liceum ogólnokształcące z oddziałami terapeutycznymi,Miasto na prawach powiatu,WIELKOPOLSKIE,260.0,Poznań-Grunwald,XXXVII LICEUM OGÓLNOKSZTAŁCĄCE Z ODDZIAŁAMI TERAPEUTYCZNYMI IM. JANA PAWŁA II W POZNANIU,"ogólnodostępny, terapeutyczny",5.716908929999995,5.716908929999995,49.19002938251538,-10.703760185848715,10.703760185848715
1,CII LO z Oddziałami Integracyjnymi im. Księdza Józefa Woźniaka,Warszawie,109.8,Warszawa ul. Bartnicza 2 03-358,Warszawa,1,56463,84,CII LICEUM OGÓLNOKSZTAŁCĄCE Z ODDZIAŁAMI INTEGRACYJNYMI IM. KSIĘDZA JÓZEFA WOŹNIAKA,CII LICEUM OGÓLNOKSZTAŁCĄCE Z ODDZIAŁAMI INTEGRACYJNYMI IM. KSIĘDZA JÓZEFA WOŹNIAKA,Warszawa,57.98411014333333,64.98042187333333,cii liceum ogólnokształcące z oddziałami integracyjnymi im. księdza józefa woźniaka,Miasto na prawach powiatu,MAZOWIECKIE,312.0,Targówek,CII LICEUM OGÓLNOKSZTAŁCĄCE Z ODDZIAŁAMI INTEGRACYJNYMI IM. KSIĘDZA JÓZEFA WOŹNIAKA,integracyjny,-6.996311729999995,6.996311729999995,63.38545882577525,-5.40134868244192,5.40134868244192
151,Liceum Ogólnokształcące Integracyjne w Białymstoku Zespołu Szkół Technicznych I Ogólnokształcących Z Oddziałami Integracyjnymi im. Stanisława Staszica w Białymstoku,Białymstoku,67.0125,Białystok ul. Sienkiewicza 57 15-002 Białystok,Białystok,151,110460,100,LICEUM OGÓLNOKSZTAŁCĄCE INTEGRACYJNE W BIAŁYMSTOKU ZESPOŁU SZKÓŁ TECHNICZNYCH I OGÓLNOKSZTAŁCĄCYCH Z ODDZIAŁAMI INTEGRACYJNYMI IM. STANISŁAWA STASZICA W BIAŁYMSTOKU,LICEUM OGÓLNOKSZTAŁCĄCE INTEGRACYJNE W BIAŁYMSTOKU ZESPOŁU SZKÓŁ TECHNICZNYCH I OGÓLNOKSZTAŁCĄCYCH Z ODDZIAŁAMI INTEGRACYJNYMI IM. STANISŁAWA STASZICA W BIAŁYMSTOKU,Białystok,57.19230769,67.94871795,liceum ogólnokształcące integracyjne w białymstoku zespołu szkół technicznych i ogólnokształcących z oddziałami integracyjnymi im. stanisława staszica w białymstoku,Miasto na prawach powiatu,PODLASKIE,110.0,Białystok,LICEUM OGÓLNOKSZTAŁCĄCE INTEGRACYJNE W BIAŁYMSTOKU ZESPOŁU SZKÓŁ TECHNICZNYCH I OGÓLNOKSZTAŁCĄCYCH Z ODDZIAŁAMI INTEGRACYJNYMI IM. STANISŁAWA STASZICA W BIAŁYMSTOKU,integracyjny,-10.756410260000003,10.756410260000003,55.96472654350914,1.2275811464908628,1.2275811464908628
16,CXI LO z Oddziałami Integracyjnymi im. Stefana Kisielewskiego,Warszawie,103.4,ul. Szczawnicka 1 04-089 Warszawa Praga-Południe,Warszawa,16,24585,84,CXI LICEUM OGÓLNOKSZTAŁCĄCE Z ODDZIAŁAMI INTEGRACYJNYMI IM. STEFANA KISIELEWSKIEGO,CXI LICEUM OGÓLNOKSZTAŁCĄCE Z ODDZIAŁAMI INTEGRACYJNYMI IM. STEFANA KISIELEWSKIEGO,Warszawa,50.11611517666668,61.33540372666667,cxi liceum ogólnokształcące z oddziałami integracyjnymi im. stefana kisielewskiego,Miasto na prawach powiatu,MAZOWIECKIE,303.0,Praga-Południe,CXI LICEUM OGÓLNOKSZTAŁCĄCE Z ODDZIAŁAMI INTEGRACYJNYMI IM. STEFANA KISIELEWSKIEGO,"ogólnodostępny, integracyjny",-11.219288549999987,11.219288549999987,62.275492442918036,-12.159377266251354,12.159377266251354
374,XXVII LO im. Tadeusza Czackiego,Warszawie,179.4,ul. Polna 5 00-625 Warszawa Śródmieście,Warszawa,374,25956,75,XXVII LICEUM OGÓLNOKSZTAŁCĄCE IM. TADEUSZA CZACKIEGO,XXVII LICEUM OGÓLNOKSZTAŁCĄCE IM. TADEUSZA CZACKIEGO,Warszawa,83.73394109333333,100.0,xxvii liceum ogólnokształcące im. tadeusza czackiego,Miasto na prawach powiatu,MAZOWIECKIE,567.0,Śródmieście,XXVII LICEUM OGÓLNOKSZTAŁCĄCE IM. TADEUSZA CZACKIEGO,ogólnodostępny,-16.26605890666667,16.26605890666667,75.45634323934749,8.277597853985839,8.277597853985839
110,IX LO im. Klementyny Hoffmanowej,Warszawie,176.86666666666665,ul. Hoża 88 00-682 Warszawa Śródmieście,Warszawa,110,27858,76,IX LICEUM OGÓLNOKSZTAŁCĄCE IM. KLEMENTYNY HOFFMANOWEJ,IX LICEUM OGÓLNOKSZTAŁCĄCE IM. KLEMENTYNY HOFFMANOWEJ,Warszawa,83.19634836333334,100.0,ix liceum ogólnokształcące im. klementyny hoffmanowej,Miasto na prawach powiatu,MAZOWIECKIE,1165.0,Śródmieście,IX LICEUM OGÓLNOKSZTAŁCĄCE IM. KLEMENTYNY HOFFMANOWEJ,ogólnodostępny,-16.803651636666658,16.803651636666658,75.01698154613317,8.179366817200176,8.179366817200176
338,XVIII Liceum Ogólnokształcące im. Stanisławy Filipiny Paleolog w Lublinie,Lublinie,54.5,ul. Przyjaźni 12 20-314 Lublin,Lublin,338,68477,100,XVIII LICEUM OGÓLNOKSZTAŁCĄCE IM. STANISŁAWY FILIPINY PALEOLOG W LUBLINIE,XVIII LICEUM OGÓLNOKSZTAŁCĄCE IM. STANISŁAWY FILIPINY PALEOLOG W LUBLINIE,Lublin,56.901315790000005,74.19908467,xviii liceum ogólnokształcące im. stanisławy filipiny paleolog w lublinie,Miasto na prawach powiatu,LUBELSKIE,264.0,Lublin,XVIII LICEUM OGÓLNOKSZTAŁCĄCE IM. STANISŁAWY FILIPINY PALEOLOG W LUBLINIE,ogólnodostępny,-17.29776888,17.29776888,53.79465554889961,3.1066602411003927,3.1066602411003927
84,III Liceum Ogólnokształcące z Oddziałami Dwujęzycznymi w ZSO im. Stefana Żeromskiego,Bielsku-Białej,159.98,ul. Bohaterów Warszawy 20 43-300 Bielsko-Biała,Bielsku-Białej,84,16426,93,XL LICEUM OGÓLNOKSZTAŁCĄCE Z ODDZIAŁAMI DWUJĘZYCZNYMI IM. STEFANA ŻEROMSKIEGO,XL LICEUM OGÓLNOKSZTAŁCĄCE Z ODDZIAŁAMI DWUJĘZYCZNYMI IM. STEFANA ŻEROMSKIEGO,Warszawa,81.78212007666667,100.0,xl liceum ogólnokształcące z oddziałami dwujęzycznymi im. stefana żeromskiego,Miasto na prawach powiatu,MAZOWIECKIE,723.0,Wola,XL LICEUM OGÓLNOKSZTAŁCĄCE Z ODDZIAŁAMI DWUJĘZYCZNYMI IM. STEFANA ŻEROMSKIEGO,"ogólnodostępny, dwujęzyczny w szkole podstawowej, liceum i technikum",-18.217879923333328,18.217879923333328,72.08828899636512,9.69383108030155,9.69383108030155
334,XVIII LO im. Jana Zamoyskiego,Warszawie,172.38333333333333,ul. Smolna 30 00-375 Warszawa Śródmieście,Warszawa,334,30251,74,XVIII LICEUM OGÓLNOKSZTAŁCĄCE IM. JANA ZAMOYSKIEGO,XVIII LICEUM OGÓLNOKSZTAŁCĄCE IM. JANA ZAMOYSKIEGO,Warszawa,81.63181738666667,100.0,xviii liceum ogólnokształcące im. jana zamoyskiego,Miasto na prawach powiatu,MAZOWIECKIE,828.0,Śródmieście,XVIII LICEUM OGÓLNOKSZTAŁCĄCE IM. JANA ZAMOYSKIEGO,ogólnodostępny,-18.36818261333333,18.36818261333333,74.23942697064204,7.392390416024625,7.392390416024625
158,Liceum Służb Mundurowych We Wrocławiu,Wroclaw,59.39615384615384,ul. Kruszwicka 8a 53-652 Wrocław Stare Miasto,Wrocław,158,263069,100,LICEUM SŁUŻB MUNDUROWYCH WE WROCŁAWIU,LICEUM SŁUŻB MUNDUROWYCH WE WROCŁAWIU,Wrocław,51.47428163666667,69.90227018,liceum służb mundurowych we wrocławiu,Osoba fizyczna,DOLNOŚLĄSKIE,1094.0,Wrocław-Stare Miasto,LICEUM SŁUŻB MUNDUROWYCH WE WROCŁAWIU,"ogólnodostępny, przygotowania wojskowego, profil mundurowy",-18.427988543333335,18.427988543333335,54.64380651366959,-3.169524877002921,3.169524877002921
400,Zespół Szkół Ogólnokształcących Nr 10 im. Eugeniusza Kwiatkowskiego w Gdańsku - XXIII Liceum Ogólnokształcące,Gdańsku,98.23333333333332,ul. Ignacego Krasickiego 10 80-515 Gdańsk,Gdańsk,400,17601,100,ZESPÓŁ SZKÓŁ OGÓLNOKSZTAŁCĄCYCH NR 10 IM. EUGENIUSZA KWIATKOWSKIEGO W GDAŃSKU - XXIII LICEUM OGÓLNOKSZTAŁCĄCE,ZESPÓŁ SZKÓŁ OGÓLNOKSZTAŁCĄCYCH NR 10 IM. EUGENIUSZA KWIATKOWSKIEGO W GDAŃSKU - XXIII LICEUM OGÓLNOKSZTAŁCĄCE,Gdańsk,59.712345676666665,78.20105819999999,zespół szkół ogólnokształcących nr 10 im. eugeniusza kwiatkowskiego w gdańsku - xxiii liceum ogólnokształcące,Miasto na prawach powiatu,POMORSKIE,295.0,Gdańsk,ZESPÓŁ SZKÓŁ OGÓLNOKSZTAŁCĄCYCH NR 10 IM. EUGENIUSZA KWIATKOWSKIEGO W GDAŃSKU - XXIII LICEUM OGÓLNOKSZTAŁCĄCE,"ogólnodostępny, integracyjny",-18.488712523333326,18.488712523333326,61.37942583175726,-1.667080155090595,1.667080155090595
174,V LO im. Księcia Józefa Poniatowskiego,Warszawie,174.55,ul. Nowolipie 8 00-150 Warszawa Śródmieście,Warszawa,174,25682,76,V LICEUM OGÓLNOKSZTAŁCĄCE IM. KS. JÓZEFA PONIATOWSKIEGO,V LICEUM OGÓLNOKSZTAŁCĄCE IM. KS. JÓZEFA PONIATOWSKIEGO,Warszawa,81.26087121333335,100.0,v liceum ogólnokształcące im. ks. józefa poniatowskiego,Miasto na prawach powiatu,MAZOWIECKIE,562.0,Śródmieście,V LICEUM OGÓLNOKSZTAŁCĄCE IM. KS. JÓZEFA PONIATOWSKIEGO,ogólnodostępny,-18.739128786666654,18.739128786666654,74.6151968398385,6.645674373494842,6.645674373494842
145,LXXXI LO im. Aleksandra Fredry,Warszawie,164.51666666666668,ul. Miła 7 00-180 Warszawa Śródmieście,Warszawa,145,22927,72,LXXXI LICEUM OGÓLNOKSZTAŁCĄCE IM. ALEKSANDRA FREDRY,LXXXI LICEUM OGÓLNOKSZTAŁCĄCE IM. ALEKSANDRA FREDRY,Warszawa,80.69553758666666,100.0,lxxxi liceum ogólnokształcące im. aleksandra fredry,Miasto na prawach powiatu,MAZOWIECKIE,537.0,Śródmieście,LXXXI LICEUM OGÓLNOKSZTAŁCĄCE IM. ALEKSANDRA FREDRY,ogólnodostępny,-19.30446241333334,19.30446241333334,72.8750932917134,7.820444294953262,7.820444294953262
396,XXXVII LO im. Jarosława Dąbrowskiego,Warszawie,167.28,ul. Świętokrzyska 1 00-360 Warszawa Śródmieście,Warszawa,396,28516,78,XXXVII LICEUM OGÓLNOKSZTAŁCĄCE IM. JAROSŁAWA DĄBROWSKIEGO,XXXVII LICEUM OGÓLNOKSZTAŁCĄCE IM. JAROSŁAWA DĄBROWSKIEGO,Warszawa,80.43234193666666,100.0,xxxvii liceum ogólnokształcące im. jarosława dąbrowskiego,Miasto na prawach powiatu,MAZOWIECKIE,727.0,Śródmieście,XXXVII LICEUM OGÓLNOKSZTAŁCĄCE IM. JAROSŁAWA DĄBROWSKIEGO,ogólnodostępny,-19.56765806333334,19.56765806333334,73.35434440181163,7.0779975348550295,7.0779975348550295
47,II LO im. Generałowej Zamoyskiej I Heleny Modrzejewskiej,Poznaniu,190.83333333333331,Poznań ul. Jana Matejki 8/10 60-766 Poznań-Grunwald Grunwald,Poznań,47,82414,83,II LICEUM OGÓLNOKSZTAŁCĄCE IM. GENERAŁOWEJ ZAMOYSKIEJ I HELENY MODRZEJEWSKIEJ,II LICEUM OGÓLNOKSZTAŁCĄCE IM. GENERAŁOWEJ ZAMOYSKIEJ I HELENY MODRZEJEWSKIEJ,Poznań,80.08777651999999,100.0,ii liceum ogólnokształcące im. generałowej zamoyskiej i heleny modrzejewskiej,Miasto na prawach powiatu,WIELKOPOLSKIE,511.0,Poznań-Grunwald,II LICEUM OGÓLNOKSZTAŁCĄCE IM. GENERAŁOWEJ ZAMOYSKIEJ I HELENY MODRZEJEWSKIEJ,"ogólnodostępny, międzynarodowy",-19.91222348000001,19.91222348000001,77.43925193372262,2.648524586277375,2.648524586277375
8,CLXI Liceum Ogólnokształcące im. Władysława Bartoszewskiego,Warszawie,138.65833333333333,ul. Smocza 19 01-051 Warszawa Wola,Warszawa,8,40982,73,VIII LICEUM OGÓLNOKSZTAŁCĄCE IM. WŁADYSŁAWA IV,VIII LICEUM OGÓLNOKSZTAŁCĄCE IM. WŁADYSŁAWA IV,Warszawa,80.06814059,100.0,viii liceum ogólnokształcące im. władysława iv,Miasto na prawach powiatu,MAZOWIECKIE,622.0,Praga-Północ,VIII LICEUM OGÓLNOKSZTAŁCĄCE IM. WŁADYSŁAWA IV,ogólnodostępny,-19.93185941,19.93185941,68.39042442972648,11.677716160273519,11.677716160273519
227,VIII LO im. Władysława IV,Warszawie,173.1,ul. Jagiellońska 38 03-719 Warszawa Praga-Północ,Warszawa,227,40982,71,VIII LICEUM OGÓLNOKSZTAŁCĄCE IM. WŁADYSŁAWA IV,VIII LICEUM OGÓLNOKSZTAŁCĄCE IM. WŁADYSŁAWA IV,Warszawa,80.06814059,100.0,viii liceum ogólnokształcące im. władysława iv,Miasto na prawach powiatu,MAZOWIECKIE,622.0,Praga-Północ,VIII LICEUM OGÓLNOKSZTAŁCĄCE IM. WŁADYSŁAWA IV,ogólnodostępny,-19.93185941,19.93185941,74.36372008122241,5.704420508777588,5.704420508777588
377,XXVIII LO im. Jana Kochanowskiego,Warszawie,170.985,ul. Wiktorska 99 02-575 Warszawa Mokotów,Warszawa,377,22592,76,XXVIII LICEUM OGÓLNOKSZTAŁCĄCE IM. JANA KOCHANOWSKIEGO,XXVIII LICEUM OGÓLNOKSZTAŁCĄCE IM. JANA KOCHANOWSKIEGO,Warszawa,79.95271388666667,100.0,xxviii liceum ogólnokształcące im. jana kochanowskiego,Miasto na prawach powiatu,MAZOWIECKIE,760.0,Mokotów,XXVIII LICEUM OGÓLNOKSZTAŁCĄCE IM. JANA KOCHANOWSKIEGO,ogólnodostępny,-20.047286113333328,20.047286113333328,73.99691087813757,5.955803008529102,5.955803008529102
32,I LO im. Karola Marcinkowskiego,Poznaniu,172.17499999999998,Poznań ul. Bukowska 16 60-809 Poznań-Grunwald Grunwald,Poznań,32,79204,72,I LICEUM OGÓLNOKSZTAŁCĄCE IM. KAROLA MARCINKOWSKIEGO,I LICEUM OGÓLNOKSZTAŁCĄCE IM. KAROLA MARCINKOWSKIEGO,Poznań,79.94228013333333,100.0,i liceum ogólnokształcące im. karola marcinkowskiego,Miasto na prawach powiatu,WIELKOPOLSKIE,788.0,Poznań,I LICEUM OGÓLNOKSZTAŁCĄCE IM. KAROLA MARCINKOWSKIEGO,"ogólnodostępny, dwujęzyczny w szkole podstawowej, liceum i technikum",-20.057719866666673,20.057719866666673,74.20329525245008,5.738984880883251,5.738984880883251
