41853;xxxviiilostanislawakostkipotockiegowwarszawie;XXXVIII LICEUM OGÓLNOKSZTAŁCĄCE IM. STANISŁAWA KOSTKI POTOCKIEGO W WARSZAWIE;publiczna;MAZOWIECKIE;Warszawa;Wilanów;gmina miejska;wilanow;dzielnica m.st. Warszawy;ul wiertnicza 26;"=""26""";"=""02-952""";44.0;44.0;100.0;44.0;;100.0;70.27272727;71.5;143.93055555555554;144.45;77.0;77.0;100.0;77.0;;100.0;66.06493506;67.0;127.90000000000002;131.10000000000002;82.0;82.0;100.0;82.0;;100.0;75.46341463;77.5;136.2625;132.925;Tak;Dzieci lub młodzież;1952.09.01;1952.09.01;Zespół szkół i placówek oświatowych;491.0;;angielski, francuski, hiszpański, niemiecki, włoski;Tak;Tak;Tak;ogólnodostępny, dwujęzyczny w szkole podstawowej, liceum i technikum;
41946;lloruybarbosy;L LICEUM OGÓLNOKSZTAŁCĄCE Z ODDZIAŁAMI INTEGRACYJNYMI IM. RUY BARBOSY;publiczna;MAZOWIECKIE;Warszawa;Praga-Północ;gmina miejska;praga polnoc;dzielnica m.st. Warszawy;ul wenantego burdzinskiego 4;"=""4""";"=""03-480""";147.0;149.0;98.65771812;149.0;;100.0;69.95973154;72.0;144.85;143.72500000000002;123.0;124.0;99.19354839;124.0;;100.0;68.09756098;70.0;99.15833333333335;106.35;127.0;128.0;99.21875;128.0;;100.0;72.87401575;75.0;133.5;133.7;Tak;Dzieci lub młodzież;1977.02.23;1977.09.01;Zespół szkół i placówek oświatowych;757.0;;angielski, łacina, niemiecki, rosyjski, portugalski;Tak;Tak;Tak;ogólnodostępny, integracyjny;
42024;ivlohenrykasienkiewicza;IV LICEUM OGÓLNOKSZTAŁCĄCE IM. HENRYKA SIENKIEWICZA;publiczna;ŚLĄSKIE;Częstochowa;Częstochowa;gmina miejska;czestochowa;miasto;al aleja najswietszej maryi panny 56;"=""56""";"=""42-217""";191.0;193.0;98.96373057;193.0;;100.0;75.30569948;77.0;;;190.0;190.0;100.0;190.0;;100.0;73.62631579;75.0;82.8;82.8;201.0;204.0;98.52941176;204.0;;100.0;63.91666667;65.0;;;Tak;Dzieci lub młodzież;1975.12.15;1975.12.15;;740.0;;angielski, francuski, niemiecki;Nie;Tak;Tak;ogólnodostępny, sportowy;
42095;vloadamamickiewicza;V LICEUM OGÓLNOKSZTAŁCĄCE IM. ADAMA MICKIEWICZA;publiczna;ŚLĄSKIE;Częstochowa;Częstochowa;gmina miejska;czestochowa;miasto;ul krakowska 29;"=""29""";"=""42-202""";148.0;149.0;99.32885906;149.0;;100.0;62.6442953;63.0;;;163.0;166.0;98.19277108;166.0;;100.0;65.89156627;65.0;107.95;106.9;145.0;150.0;96.66666667;150.0;;98.66666667;55.19333333;55.0;;;Tak;Dzieci lub młodzież;1977.01.01;1977.01.01;;788.0;boiska uniwersalne/wielozadaniowe;angielski, francuski, hiszpański, niemiecki;Nie;Tak;Tak;ogólnodostępny;
42262;viilomikolajakopernika;VII LICEUM OGÓLNOKSZTAŁCĄCE IM. MIKOŁAJA KOPERNIKA;publiczna;ŚLĄSKIE;Częstochowa;Częstochowa;gmina miejska;czestochowa;miasto;ul feliksa nowowiejskiego 18;"=""18""";"=""42-217""";181.0;181.0;100.0;181.0;;100.0;74.73888889;77.0;;;208.0;208.0;100.0;208.0;;100.0;74.47342995;77.0;128.35;131.85;171.0;172.0;99.41860465;172.0;;100.0;68.9244186;70.0;;;Tak;Dzieci lub młodzież;1977.01.01;1977.01.01;;788.0;boiska uniwersalne/wielozadaniowe;angielski, francuski, niemiecki, rosyjski;Nie;Tak;Tak;ogólnodostępny;
42509;loxiiialeksandrafredry;LICEUM OGÓLNOKSZTAŁCĄCE NR XIII IM.ALEKSANDRA FREDRY;publiczna;DOLNOŚLĄSKIE;Wrocław;Wrocław-Krzyki;gmina miejska;wroclaw krzyki;delegatura;ul gen jozefa haukego bosaka 33 37;"=""33-37""";"=""50-447""";247.0;247.0;100.0;247.0;;100.0;76.13821138;78.0;160.02666666666667;160.3;204.0;204.0;100.0;204.0;;100.0;79.58333333;80.0;151.70999999999998;151.5;232.0;232.0;100.0;232.0;;100.0;77.24137931;78.0;159.15;158.775;Tak;Dzieci lub młodzież;1977.01.01;1977.01.01;;1184.0;;angielski, francuski, niemiecki, rosyjski;Nie;Tak;Tak;ogólnodostępny;
43385;lxxviiilomariipawlikowskiejjasnorzewskiej;LXXVIII LICEUM OGÓLNOKSZTAŁCĄCE IM. MARII PAWLIKOWSKIEJ-JASNORZEWSKIEJ;publiczna;MAZOWIECKIE;Warszawa;Bemowo;gmina miejska;bemowo;dzielnica m.st. Warszawy;ul anieli krzywon 3;"=""3""";"=""01-391""";175.0;175.0;100.0;175.0;;100.0;68.09142857;68.0;137.263;136.325;147.0;147.0;100.0;148.0;;100.0;74.26351351;75.0;114.97666666666667;114.2;148.0;149.0;99.32885906;149.0;;100.0;74.98657718;75.0;137.45166666666668;137.85000000000002;Tak;Dzieci lub młodzież;1992.04.29;1992.09.01;;908.0;boiska do siatkówki plażowej, boiska do koszykówki, boiska do piłki ręcznej, boiska do piłki nożnej, bieżnie proste, bieżnie okólne, skocznie, boiska uniwersalne/wielozadaniowe;angielski, hiszpański, niemiecki;Nie;Tak;Tak;ogólnodostępny, dwujęzyczny w szkole podstawowej, liceum i technikum;
43558;xilojadwigiiwaclawazembrzuskich;XI LICEUM OGÓLNOKSZTAŁCĄCE IM. JADWIGI I WACŁAWA ZEMBRZUSKICH;publiczna;WIELKOPOLSKIE;Poznań;Poznań-Grunwald;gmina miejska;poznan grunwald;delegatura;ul piotra sciegiennego 134;"=""134""";"=""60-304""";127.0;127.0;100.0;127.0;;100.0;73.77165354;73.0;146.63333333333333;150.675;150.0;150.0;100.0;150.0;;100.0;69.87333333;72.0;139.1625;136.52499999999998;165.0;166.0;99.39759036;166.0;;100.0;70.13939394;72.0;146.29999999999998;148.725;Tak;Dzieci lub młodzież;1964.09.01;1964.09.01;;722.0;boiska do piłki ręcznej, skocznie;angielski, hiszpański, łacina, niemiecki, rosyjski;Nie;Tak;Tak;ogólnodostępny;
43580;loswmariimagdaleny;LICEUM OGÓLNOKSZTAŁCĄCE ŚW. MARII MAGDALENY;publiczna;WIELKOPOLSKIE;Poznań;Poznań;gmina miejska;poznan;miasto;ul garbary 24;"=""24""";"=""61-867""";108.0;108.0;100.0;108.0;5.0;100.0;80.53703704;82.0;161.94285714285712;166.7;170.0;170.0;100.0;170.0;4.0;100.0;75.55029586;77.0;168.8625;168.0;147.0;147.0;100.0;147.0;1.0;100.0;82.19047619;83.0;172.62;172.6;Tak;Dzieci lub młodzież;;;;643.0;boiska uniwersalne/wielozadaniowe;angielski, francuski, hiszpański, niemiecki;Nie;Tak;Nie;ogólnodostępny;
44248;cxxxviilorobertaschumana;CXXXVII LICEUM OGÓLNOKSZTAŁCĄCE Z ODDZIAŁAMI DWUJĘZYCZNYMI IM. ROBERTA SCHUMANA;publiczna;MAZOWIECKIE;Warszawa;Targówek;gmina miejska;targowek;dzielnica m.st. Warszawy;ul olgierda 35 41;"=""35/41""";"=""03-536""";153.0;153.0;100.0;153.0;;100.0;74.75;75.0;171.32;175.54;172.0;172.0;100.0;172.0;;100.0;74.70930233;75.0;149.975;153.47;165.0;165.0;100.0;166.0;;100.0;74.23493976;73.0;132.74285714285716;151.87;Tak;Dzieci lub młodzież;2010.09.01;2010.09.01;;679.0;bieżnie proste, bieżnie okólne, boiska uniwersalne/wielozadaniowe;angielski, francuski, hiszpański, niemiecki;Nie;Tak;Tak;ogólnodostępny, dwujęzyczny w szkole podstawowej, liceum i technikum;
46647;lxxxivlobohaterownarwiku;LXXXIV LICEUM OGÓLNOKSZTAŁCĄCE IM. BOHATERÓW NARWIKU;publiczna;MAZOWIECKIE;Warszawa;Włochy;gmina miejska;wlochy;dzielnica m.st. Warszawy;ul gladka 16;"=""16""";"=""02-172""";16.0;16.0;100.0;16.0;;100.0;70.5;71.0;;;17.0;17.0;100.0;17.0;;100.0;69.23529412;72.0;137.825;137.825;21.0;21.0;100.0;21.0;;100.0;71.28571429;73.0;152.02499999999998;152.02499999999998;Tak;Dzieci lub młodzież;2002.04.17;2002.04.17;Zespół szkół i placówek oświatowych;134.0;;angielski, hiszpański, niemiecki;Nie;Tak;Tak;ogólnodostępny;
49970;xxxiilostefanagrotaroweckiego;XXXII LICEUM OGÓLNOKSZTAŁCĄCE IM. STEFANA GROTA-ROWECKIEGO;publiczna;MAZOWIECKIE;Warszawa;Śródmieście;gmina miejska;srodmiescie;dzielnica m.st. Warszawy;ul stawki 10;"=""10""";"=""00-178""";36.0;41.0;87.80487805;41.0;;97.56097561;58.19512195;58.0;;;16.0;19.0;84.21052632;19.0;;100.0;76.47368421;80.0;90.35;90.35;20.0;21.0;95.23809524;21.0;;100.0;60.71428571;60.0;120.65;120.65;Tak;Dzieci lub młodzież;1990.09.01;1990.09.01;Zespół szkół i placówek oświatowych;161.0;;angielski, niemiecki, rosyjski, włoski;Nie;Tak;Tak;ogólnodostępny;
51790;vilohugonakollatajawlublinie;VI LICEUM OGÓLNOKSZTAŁCĄCE IM. HUGONA KOŁŁĄTAJA W LUBLINIE;publiczna;LUBELSKIE;Lublin;Lublin;gmina miejska;lublin;miasto;ul adama mickiewicza 36;"=""36""";"=""20-466""";111.0;116.0;95.68965517;116.0;;99.13793103;64.0;65.0;118.86875;118.325;103.0;106.0;97.16981132;106.0;;99.05660377;60.96226415;62.0;101.68333333333334;102.15;115.0;129.0;89.14728682;129.0;;97.6744186;56.4375;55.0;91.8625;91.525;Tak;Dzieci lub młodzież;1948.06.23;1948.09.01;;793.0;boiska do piłki nożnej;angielski, francuski, hiszpański, niemiecki, rosyjski;Nie;Tak;Tak;ogólnodostępny;
52409;ilostanislawastaszicawlublinie;I LICEUM OGÓLNOKSZTAŁCĄCE IM.STANISŁAWA STASZICA W LUBLINIE;publiczna;LUBELSKIE;Lublin;Lublin;gmina miejska;lublin;miasto;ul aleje raclawickie 26;"=""26""";"=""20-043""";117.0;117.0;100.0;117.0;1.0;100.0;76.88888889;77.0;165.4;163.75;134.0;134.0;100.0;134.0;1.0;100.0;79.26119403;80.0;168.15;170.95;143.0;143.0;100.0;143.0;;100.0;75.58741259;77.0;161.83333333333334;167.875;Tak;Dzieci lub młodzież;;;;739.0;boiska do siatkówki, boiska uniwersalne/wielozadaniowe;angielski, hiszpański, niemiecki;Nie;Tak;Nie;ogólnodostępny, międzynarodowy;
52410;iilohetmanajanazamoyskiegowlublinie;II LICEUM OGÓLNOKSZTAŁCĄCE IM. HETMANA JANA ZAMOYSKIEGO W LUBLINIE;publiczna;LUBELSKIE;Lublin;Lublin;gmina miejska;lublin;miasto;ul ogrodowa 16;"=""16""";"=""20-075""";182.0;182.0;100.0;182.0;;100.0;78.21428571;78.0;162.29285714285714;163.2;163.0;163.0;100.0;163.0;;100.0;73.74846626;73.0;159.95;162.7;180.0;180.0;100.0;180.0;;100.0;73.09444444;75.0;164.79999999999998;163.3;Tak;Dzieci lub młodzież;1915.09.01;1915.09.01;;704.0;boiska uniwersalne/wielozadaniowe;angielski, francuski, hiszpański, niemiecki;Nie;Tak;Tak;ogólnodostępny;
52697;iiilouniilubelskiejwlublinie;III LICEUM OGÓLNOKSZTAŁCĄCE IM. UNII LUBELSKIEJ W LUBLINIE;publiczna;LUBELSKIE;Lublin;Lublin;gmina miejska;lublin;miasto;pl plac wolnosci 4;"=""4""";"=""20-005""";160.0;160.0;100.0;160.0;1.0;100.0;79.65;82.0;165.8;168.97500000000002;205.0;205.0;100.0;205.0;;100.0;79.69268293;80.0;163.75;161.77499999999998;192.0;192.0;100.0;192.0;6.0;100.0;81.47395833;82.0;175.10999999999999;173.55;Tak;Dzieci lub młodzież;1921.10.07;1921.10.07;;653.0;boiska do koszykówki, boiska do piłki ręcznej;angielski, francuski, hiszpański, niemiecki;Nie;Tak;Tak;ogólnodostępny;
52853;vlomariisklodowskiejcuriewlublinie;V LICEUM OGÓLNOKSZTAŁCĄCE IM. MARII SKŁODOWSKIEJ-CURIE W LUBLINIE;publiczna;LUBELSKIE;Lublin;Lublin;gmina miejska;lublin;miasto;ul lipowa 7;"=""7""";"=""20-020""";155.0;155.0;100.0;155.0;;100.0;74.45806452;75.0;158.75;159.2;209.0;209.0;100.0;209.0;;100.0;72.19617225;72.0;138.5;139.95;213.0;213.0;100.0;213.0;;100.0;70.50471698;70.0;155.11666666666667;155.025;Tak;Dzieci lub młodzież;1975.12.15;1975.12.15;;883.0;inne urządzenia sportowe, boiska uniwersalne/wielozadaniowe;angielski, hiszpański, niemiecki;Tak;Nie;Tak;ogólnodostępny;
52854;ivlostefaniisempolowskiejwlublinie;IV LICEUM OGÓLNOKSZTAŁCĄCE IM. STEFANII SEMPOŁOWSKIEJ W LUBLINIE;publiczna;LUBELSKIE;Lublin;Lublin;gmina miejska;lublin;miasto;ul szkolna 4;"=""4""";"=""20-124""";165.0;165.0;100.0;165.0;;100.0;70.09090909;70.0;149.52857142857144;148.35;193.0;193.0;100.0;193.0;;100.0;73.72916667;75.0;122.76666666666667;118.25;190.0;190.0;100.0;190.0;;100.0;66.46315789;67.0;132.89166666666668;132.7;Tak;Dzieci lub młodzież;1966.09.01;1966.09.01;;863.0;boiska do siatkówki, boiska do koszykówki, boiska do piłki ręcznej;angielski, hiszpański, niemiecki;Nie;Tak;Tak;ogólnodostępny;
52855;viiilozofiinalkowskiejwlublinie;VIII LICEUM OGÓLNOKSZTAŁCĄCE IM. ZOFII NAŁKOWSKIEJ W LUBLINIE;publiczna;LUBELSKIE;Lublin;Lublin;gmina miejska;lublin;miasto;ul slowicza 5;"=""5""";"=""20-336""";102.0;120.0;85.0;120.0;;98.33333333;61.06666667;63.0;88.15833333333335;89.975;108.0;124.0;87.09677419;124.0;;98.38709677;64.91129032;67.0;65.625;65.625;64.0;69.0;92.75362319;69.0;;98.55072464;65.4057971;67.0;82.6375;80.25;Tak;Dzieci lub młodzież;1926.09.01;1926.09.01;;495.0;boiska do siatkówki, boiska do koszykówki, boiska do piłki nożnej;angielski, hiszpański, niemiecki, rosyjski;Nie;Tak;Tak;ogólnodostępny;
52857;ixlomikolajakopernikawlublinie;IX LICEUM OGÓLNOKSZTAŁCĄCE IM. MIKOŁAJA KOPERNIKA W LUBLINIE;publiczna;LUBELSKIE;Lublin;Lublin;gmina miejska;lublin;miasto;ul andrzeja struga 6;"=""6""";"=""20-709""";162.0;162.0;100.0;162.0;;100.0;73.9691358;75.0;160.15;167.35;183.0;184.0;99.45652174;184.0;;99.45652174;75.14835165;77.0;148.79166666666666;154.075;191.0;191.0;100.0;191.0;;100.0;72.70680628;73.0;158.03333333333333;161.975;Tak;Dzieci lub młodzież;1972.09.01;1972.09.01;;703.0;boiska do siatkówki, boiska do koszykówki, boiska do piłki ręcznej, bieżnie proste, skocznie;angielski, francuski, hiszpański, niemiecki, włoski;Nie;Tak;Nie;ogólnodostępny, dwujęzyczny w szkole podstawowej, liceum i technikum;
52860;xxiiilonauczycielitajnegonauczaniawlublinie;XXIII LICEUM OGÓLNOKSZTAŁCĄCE IM. NAUCZYCIELI TAJNEGO NAUCZANIA W LUBLINIE;publiczna;LUBELSKIE;Lublin;Lublin;gmina miejska;lublin;miasto;ul jozefa poniatowskiego 5;"=""5""";"=""20-060""";168.0;169.0;99.40828402;169.0;;100.0;67.08284024;68.0;141.91666666666666;143.3;157.0;160.0;98.125;160.0;;99.375;64.18867925;65.0;119.175;118.8;219.0;223.0;98.20627803;223.0;;100.0;62.73991031;63.0;128.75;127.025;Tak;Dzieci lub młodzież;1998.09.01;1998.09.01;;867.0;;angielski, hiszpański, niemiecki, włoski;Nie;Tak;Tak;ogólnodostępny, dwujęzyczny w szkole podstawowej, liceum i technikum;
56095;iilostefanabatorego;II LICEUM OGÓLNOKSZTAŁCĄCE Z ODDZIAŁAMI DWUJĘZYCZNYMI IM. STEFANA BATOREGO;publiczna;MAZOWIECKIE;Warszawa;Śródmieście;gmina miejska;srodmiescie;dzielnica m.st. Warszawy;ul mysliwiecka 6;"=""6""";"=""00-459""";112.0;112.0;100.0;112.0;2.0;100.0;84.60714286;85.0;182.91400000000002;183.56;114.0;114.0;100.0;114.0;1.0;100.0;80.93859649;82.0;185.35;188.36;118.0;118.0;100.0;118.0;;100.0;81.63559322;83.0;186.29;188.0;Tak;Dzieci lub młodzież;1918.09.01;1918.09.01;;801.0;boiska do koszykówki, boiska do piłki ręcznej, bieżnie okólne;angielski, niemiecki;Nie;Tak;Tak;ogólnodostępny, międzynarodowy, dwujęzyczny w szkole podstawowej, liceum i technikum;
56370;liiilo;LIII LICEUM OGÓLNOKSZTAŁCĄCE DLA DOROSŁYCH;publiczna;MAZOWIECKIE;Warszawa;Śródmieście;gmina miejska;srodmiescie;dzielnica m.st. Warszawy;ul stanislawa noakowskiego 6;"=""6""";"=""00-666""";;;;;;;;;;;55.0;68.0;80.88235294;69.0;;94.11764706;53.53623188;55.0;156.17222222222222;157.0;84.0;143.0;58.74125874;144.0;;98.6013986;54.06993007;53.0;160.85;160.45;Tak;Dorośli;2004.09.01;2004.09.01;Placówka Kształcenia Ustawicznego ze szkołami;907.0;;angielski;Nie;Tak;Tak;ogólnodostępny;
56463;ciiloksiedzajozefawozniaka;CII LICEUM OGÓLNOKSZTAŁCĄCE Z ODDZIAŁAMI INTEGRACYJNYMI IM. KSIĘDZA JÓZEFA WOŹNIAKA;publiczna;MAZOWIECKIE;Warszawa;Targówek;gmina miejska;targowek;dzielnica m.st. Warszawy;ul bartnicza 2;"=""2""";"=""03-358""";20.0;35.0;57.14285714;35.0;;85.71428571;51.37142857;55.0;;;21.0;29.0;72.4137931;29.0;;96.55172414;62.96551724;65.0;;;17.0;26.0;65.38461538;26.0;;92.30769231;59.61538462;64.0;109.8;109.35;Tak;Dzieci lub młodzież;1997.01.01;1997.09.01;Zespół szkół i placówek oświatowych;312.0;;angielski, hiszpański, niemiecki, rosyjski;Tak;Tak;Tak;integracyjny;
57618;xviiilo;XVIII LICEUM OGÓLNOKSZTAŁCĄCE;publiczna;KUJAWSKO-POMORSKIE;Bydgoszcz;Bydgoszcz;gmina miejska;bydgoszcz;miasto;ul zygmunta krasinskiego 10;"=""10""";"=""85-008""";;;;;;;;;;;;;;;;;;;;;0.0;1.0;;1.0;;;;;79.51666666666667;63.75;Tak;Dzieci lub młodzież;1994.12.30;1994.12.30;Specjalny Ośrodek Szkolno-Wychowawczy;35.0;;angielski, niemiecki, rosyjski;Tak;Tak;Tak;specjalny;
59581;lilotadeuszakosciuszki;LI LICEUM OGÓLNOKSZTAŁCĄCE IM. TADEUSZA KOŚCIUSZKI;publiczna;MAZOWIECKIE;Warszawa;Rembertów;gmina miejska;rembertow;dzielnica m.st. Warszawy;ul kadrowa 9;"=""9""";"=""04-421""";104.0;106.0;98.11320755;106.0;;100.0;63.40566038;63.0;105.60000000000001;111.9;67.0;67.0;100.0;67.0;;100.0;63.19402985;62.0;123.875;123.875;72.0;73.0;98.63013699;74.0;;100.0;62.78378378;63.0;105.975;109.67500000000001;Tak;Dzieci lub młodzież;1944.10.19;1944.10.19;;505.0;boiska do siatkówki, boiska do koszykówki, boiska do piłki ręcznej, bieżnie proste, bieżnie okólne, skocznie, rzutnie;angielski, hiszpański, niemiecki, rosyjski;Nie;Tak;Tak;ogólnodostępny;Oddział przygotowawczy
59665;xiiiloplkleopoldalisakuli;XIII LICEUM OGÓLNOKSZTAŁCĄCE Z ODDZIAŁAMI DWUJĘZYCZNYMI IM. PŁK. LEOPOLDA LISA-KULI;publiczna;MAZOWIECKIE;Warszawa;Targówek;gmina miejska;targowek;dzielnica m.st. Warszawy;ul oszmianska 23 25;"=""23/25""";"=""03-503""";187.0;188.0;99.46808511;189.0;;100.0;71.03191489;72.0;157.46666666666667;156.75;213.0;213.0;100.0;214.0;;100.0;78.18691589;80.0;159.4125;160.9;213.0;213.0;100.0;213.0;;100.0;77.21126761;78.0;155.10625;158.39999999999998;Tak;Dzieci lub młodzież;1928.01.01;1928.09.01;;1122.0;boiska do siatkówki, boiska do koszykówki, bieżnie proste, skocznie, boiska uniwersalne/wielozadaniowe;angielski, francuski, hiszpański, niemiecki;Nie;Nie;Tak;ogólnodostępny;
68270;loixjuliuszaslowackiego;LICEUM OGÓLNOKSZTAŁCĄCE NR IX IM. JULIUSZA SŁOWACKIEGO;publiczna;DOLNOŚLĄSKIE;Wrocław;Wrocław-Stare Miasto;gmina miejska;wroclaw stare miasto;delegatura;ul ks piotra skargi 31;"=""31""";"=""50-082""";226.0;226.0;100.0;226.0;;100.0;76.84955752;78.0;171.64545454545453;171.8;236.0;236.0;100.0;236.0;1.0;100.0;72.00847458;75.0;157.79285714285714;158.15;273.0;274.0;99.6350365;274.0;;99.6350365;74.26642336;75.0;165.20666666666665;166.85;Tak;Dzieci lub młodzież;1954.09.01;1954.09.01;;1185.0;boiska do koszykówki, inne urządzenia sportowe, boiska uniwersalne/wielozadaniowe;angielski, francuski, hiszpański, niemiecki, rosyjski, włoski, czeski;Nie;Tak;Tak;ogólnodostępny, dwujęzyczny w szkole podstawowej, liceum i technikum;
68321;loxivpoloniibelgijskiej;LICEUM OGÓLNOKSZTAŁCĄCE NR XIV IM. POLONII BELGIJSKIEJ;publiczna;DOLNOŚLĄSKIE;Wrocław;Wrocław-Psie Pole;gmina miejska;wroclaw psie pole;delegatura;al aleksandra brücknera 10;"=""10""";"=""51-410""";170.0;170.0;100.0;170.0;1.0;100.0;79.32352941;82.0;161.31666666666666;158.8;179.0;179.0;100.0;179.0;1.0;100.0;74.25280899;75.0;104.475;104.975;204.0;205.0;99.51219512;205.0;1.0;100.0;76.21463415;77.0;163.575;164.025;Tak;Dzieci lub młodzież;1975.12.15;1975.12.15;;912.0;boiska do piłki nożnej, bieżnie okólne, inne urządzenia sportowe, boiska uniwersalne/wielozadaniowe;angielski, francuski, hiszpański, niemiecki;Nie;Nie;Nie;ogólnodostępny, dwujęzyczny w szkole podstawowej, liceum i technikum;
68477;xviiilostanislawyfilipinypaleologwlublinie;XVIII LICEUM OGÓLNOKSZTAŁCĄCE IM. STANISŁAWY FILIPINY PALEOLOG W LUBLINIE;publiczna;LUBELSKIE;Lublin;Lublin;gmina miejska;lublin;miasto;ul przyjazni 12;"=""12""";"=""20-314""";30.0;40.0;75.0;40.0;;97.5;55.125;55.0;;;17.0;23.0;73.91304348;23.0;;95.65217391;61.0;67.0;52.375;52.375;14.0;19.0;73.68421053;19.0;;100.0;54.57894737;53.0;54.5;54.5;Tak;Dzieci lub młodzież;1991.09.01;1991.09.01;Zespół szkół i placówek oświatowych;264.0;;angielski, niemiecki;Nie;Tak;Tak;ogólnodostępny;
70905;xviilowbialymstokuzespoluszkolrolniczychwbialymstoku;XVII LICEUM OGÓLNOKSZTAŁCĄCE W BIAŁYMSTOKU ZESPOŁU SZKÓŁ ROLNICZYCH W BIAŁYMSTOKU;publiczna;PODLASKIE;Białystok;Białystok;gmina miejska;bialystok;miasto;ul ks stanislawa suchowolca 26;"=""26""";"=""15-567""";19.0;32.0;59.375;32.0;;75.0;38.21875;38.0;;;27.0;32.0;84.375;32.0;;90.625;47.28125;45.0;291.0;291.0;13.0;16.0;81.25;16.0;;100.0;52.8125;50.0;60.65;60.65;Tak;Dzieci lub młodzież;2002.09.01;2002.09.01;Zespół szkół i placówek oświatowych;98.0;;angielski, niemiecki;Nie;Nie;Tak;ogólnodostępny, mistrzostwa sportowego;
71604;ixlowbialymstokuzespoluszkologolnoksztalcacychitechnicznychwbialymstoku;IX LICEUM OGÓLNOKSZTAŁCĄCE W BIAŁYMSTOKU ZESPOŁU SZKÓŁ OGÓLNOKSZTAŁCĄCYCH I TECHNICZNYCH W BIAŁYMSTOKU;publiczna;PODLASKIE;Białystok;Białystok;gmina miejska;bialystok;miasto;ul antoniuk fabryczny 1;"=""1""";"=""15-762""";38.0;52.0;73.07692308;53.0;;78.84615385;36.0754717;38.0;;;33.0;44.0;75.0;44.0;;81.81818182;36.81818182;37.0;33.35;34.0;32.0;66.0;48.48484848;66.0;;90.90909091;44.31818182;46.0;59.116666666666674;55.825;Tak;Dzieci lub młodzież;1991.03.06;1991.09.01;Zespół szkół i placówek oświatowych;423.0;;angielski, niemiecki, rosyjski;Nie;Nie;Tak;ogólnodostępny, mistrzostwa sportowego;Oddział przygotowawczy
74772;iilodrwladyslawapniewskiegowgdansku;II LICEUM OGÓLNOKSZTAŁCĄCE IM. DR. WŁADYSŁAWA PNIEWSKIEGO W GDAŃSKU;publiczna;POMORSKIE;Gdańsk;Gdańsk;gmina miejska;gdansk;miasto;ul jana pestalozziego 7 9;"=""7/9""";"=""80-445""";141.0;141.0;100.0;141.0;;100.0;75.41843972;77.0;168.822;171.85;152.0;153.0;99.34640523;153.0;;100.0;72.46405229;73.0;161.7125;162.975;202.0;202.0;100.0;202.0;1.0;100.0;68.56435644;70.0;166.42000000000002;168.55;Tak;Dzieci lub młodzież;1945.04.15;1945.04.15;;637.0;boiska do siatkówki, boiska do piłki ręcznej, boiska do piłki nożnej, bieżnie okólne, skocznie;angielski, francuski, hiszpański, niemiecki, włoski, Inny;Nie;Tak;Nie;ogólnodostępny;
74951;lozakwszczecinie;"LICEUM OGÓLNOKSZTAŁCĄCE DLA DOROSŁYCH ""ŻAK"" W SZCZECINIE";niepubliczna;ZACHODNIOPOMORSKIE;Szczecin;Szczecin;gmina miejska;szczecin;miasto;al wojska polskiego 29;"=""29""";"=""70-473""";;;;;;;;;;;8.0;24.0;33.33333333;30.0;;75.0;34.5;36.0;128.3;128.375;18.0;42.0;42.85714286;52.0;;76.19047619;37.33333333;40.0;143.01999999999998;143.1;Nie;Dorośli;2007.08.03;2007.09.01;;620.0;;angielski;Nie;Nie;Nie;ogólnodostępny;
75450;ivlomariisklodowskiejcuriewolsztynie;IV LICEUM OGÓLNOKSZTAŁCĄCE IM. MARII SKŁODOWSKIEJ-CURIE W OLSZTYNIE;publiczna;WARMIŃSKO-MAZURSKIE;Olsztyn;Olsztyn;gmina miejska;olsztyn;miasto;al aleja marszalka jozefa pilsudskiego 56;"=""56""";"=""10-450""";148.0;152.0;97.36842105;152.0;;98.68421053;69.1986755;72.0;146.83333333333334;148.425;120.0;123.0;97.56097561;123.0;;99.18699187;62.29508197;63.0;138.06;141.2;155.0;157.0;98.72611465;157.0;;100.0;61.6433121;60.0;;;Tak;Dzieci lub młodzież;1977.09.01;1977.09.01;Zespół szkół i placówek oświatowych;698.0;;angielski;Nie;Tak;Tak;ogólnodostępny;
79023;xixlomariiijerzegokuncewiczowwlublinie;XIX LICEUM OGÓLNOKSZTAŁCĄCE IM. MARII I JERZEGO KUNCEWICZÓW W LUBLINIE;publiczna;LUBELSKIE;Lublin;Lublin;gmina miejska;lublin;miasto;ul ignacego rzeckiego 10;"=""10""";"=""20-637""";70.0;79.0;88.60759494;79.0;;100.0;57.59493671;55.0;95.57142857142857;94.25;45.0;51.0;88.23529412;51.0;;98.03921569;58.47058824;60.0;84.125;80.0;47.0;54.0;87.03703704;54.0;;98.14814815;53.24074074;51.0;87.6875;90.25;Tak;Dzieci lub młodzież;1991.09.01;1991.09.01;Zespół szkół i placówek oświatowych;498.0;;angielski, hiszpański, niemiecki, rosyjski;Tak;Tak;Nie;ogólnodostępny;
79204;ilokarolamarcinkowskiego;I LICEUM OGÓLNOKSZTAŁCĄCE IM. KAROLA MARCINKOWSKIEGO;publiczna;WIELKOPOLSKIE;Poznań;Poznań;gmina miejska;poznan;miasto;ul bukowska 16;"=""16""";"=""60-809""";189.0;189.0;100.0;189.0;;100.0;79.75661376;82.0;175.35;169.7;159.0;159.0;100.0;159.0;;100.0;79.52531646;80.0;170.125;167.5;168.0;168.0;100.0;168.0;;100.0;80.54491018;82.0;172.175;168.925;Tak;Dzieci lub młodzież;1919.04.01;1919.05.01;Zespół szkół i placówek oświatowych;788.0;;angielski, francuski, hiszpański, niemiecki;Nie;Tak;Tak;ogólnodostępny, dwujęzyczny w szkole podstawowej, liceum i technikum;
79336;xxlowlublinie;XX LICEUM OGÓLNOKSZTAŁCĄCE W LUBLINIE;publiczna;LUBELSKIE;Lublin;Lublin;gmina miejska;lublin;miasto;ul kazimierza tumidajskiego 6a;"=""6a""";"=""20-247""";15.0;15.0;100.0;15.0;;100.0;56.8;62.0;92.75;92.75;9.0;10.0;90.0;11.0;;100.0;59.45454545;60.0;;;;;;;;;;;;;Tak;Dzieci lub młodzież;1992.07.01;1993.09.01;Zespół szkół i placówek oświatowych;19.0;;angielski, hiszpański, niemiecki;Tak;Tak;Tak;ogólnodostępny;
79348;katolickieloswmaksymilianamariikolbego;KATOLICKIE LICEUM OGÓLNOKSZTAŁCĄCE IM. ŚW. MAKSYMILIANA MARII KOLBEGO;publiczna;ZACHODNIOPOMORSKIE;Szczecin;Szczecin;gmina miejska;szczecin;miasto;al wojska polskiego 76;"=""76""";"=""70-481""";28.0;28.0;100.0;28.0;;100.0;77.89285714;82.5;147.52499999999998;147.52499999999998;47.0;47.0;100.0;47.0;;100.0;76.21276596;80.0;136.125;137.375;48.0;48.0;100.0;48.0;;100.0;73.4375;73.0;140.71666666666667;143.4;Tak;Dzieci lub młodzież;2002.05.16;2002.09.01;;178.0;;angielski, niemiecki;Nie;Tak;Tak;ogólnodostępny;
79937;xxilogenwladyslawaandersa;XXI LICEUM OGÓLNOKSZTAŁCĄCE IM. GEN. WŁADYSŁAWA ANDERSA;publiczna;WIELKOPOLSKIE;Poznań;Poznań-Stare Miasto;gmina miejska;poznan stare miasto;delegatura;ul rybaki 17;"=""17""";"=""61-883""";71.0;72.0;98.61111111;72.0;;100.0;65.13888889;66.0;;;45.0;46.0;97.82608696;46.0;;100.0;70.15217391;71.0;115.92500000000001;115.92500000000001;83.0;84.0;98.80952381;84.0;;100.0;66.32142857;67.0;119.825;119.825;Tak;Dzieci lub młodzież;1991.08.02;1991.09.01;Zespół szkół i placówek oświatowych;376.0;;angielski, niemiecki;Nie;Tak;Tak;ogólnodostępny;
80197;cxxviiilo;CXXVIII LICEUM OGÓLNOKSZTAŁCĄCE DLA DOROSŁYCH;publiczna;MAZOWIECKIE;Warszawa;Wola;gmina miejska;wola;dzielnica m.st. Warszawy;ul ksiecia janusza 45 47;"=""45/47""";"=""01-452""";;;;;;;;;;;26.0;36.0;72.22222222;37.0;;91.66666667;49.47222222;52.0;156.17222222222222;157.0;31.0;72.0;43.05555556;75.0;;90.27777778;52.66216216;55.0;160.85;160.45;Tak;Dorośli;2004.09.01;2004.09.01;Placówka Kształcenia Ustawicznego ze szkołami;595.0;;angielski;Nie;Tak;Tak;ogólnodostępny;
81335;lxxxloleopoldastaffa;LXXX LICEUM OGÓLNOKSZTAŁCĄCE IM. LEOPOLDA STAFFA;publiczna;MAZOWIECKIE;Warszawa;Mokotów;gmina miejska;mokotow;dzielnica m.st. Warszawy;ul wisniowa 56;"=""56""";"=""02-520""";81.0;81.0;100.0;81.0;;100.0;75.04938272;78.0;159.25833333333333;161.575;47.0;47.0;100.0;47.0;;100.0;65.31914894;63.0;142.675;142.675;57.0;57.0;100.0;57.0;;100.0;71.22807018;72.0;149.875;149.875;Tak;Dzieci lub młodzież;1992.05.11;1992.09.01;Zespół szkół i placówek oświatowych;328.0;;angielski, hiszpański, niemiecki, rosyjski;Nie;Tak;Tak;ogólnodostępny;
