RSPO;nazwa_szkoly;pelna_nazwa_szkoly;publicznosc_status;wojewodztwo;powiat;gmina;typ_gminy;miejscowosc;rodzaj_miejscowości;ulica_nr;numer_budynku;kod_pocztowy;23.0_O_otrzymali_swiadectwo_dojrzałosci;23.0_O_liczba_zdających;23.0_O_zdawalnosc;23.0_polski_liczba_zdajacych;23.0_polski_liczba_laureatow;23.0_polski_zdawalnosc;23.0_polski_mean;23.0_polski_median;23.0_avg_threshold;23.0_median_threshold;24.0_O_otrzymali_swiadectwo_dojrzałosci;24.0_O_liczba_zdających;24.0_O_zdawalnosc;24.0_polski_liczba_zdajacych;24.0_polski_liczba_laureatow;24.0_polski_zdawalnosc;24.0_polski_mean;24.0_polski_median;24.0_avg_threshold;24.0_median_threshold;25.0_O_otrzymali_swiadectwo_dojrzałosci;25.0_O_liczba_zdających;25.0_O_zdawalnosc;25.0_polski_liczba_zdajacych;25.0_polski_liczba_laureatow;25.0_polski_zdawalnosc;25.0_polski_mean;25.0_polski_median;25.0_avg_threshold;25.0_median_threshold;czy_publiczna;kategoria_uczniow;data_zalozenia;data_rozpoczecia_dzialalnosci;typ_podmiotu_nadrzednego;liczba_uczniow;tereny_sportowe;jezyki_nauczane;czy_zatrudnia_logopede;czy_zatrudnia_psychologa;czy_zatrudnia_pedagoga;oddzialy_podstawowe_wg_specyfiki;oddzialy_dodatkowe
2982;loswjadwigikrolowejwkielcach;LICEUM OGÓLNOKSZTAŁCĄCE IM. ŚW. JADWIGI KRÓLOWEJ W KIELCACH;publiczna;ŚWIĘTOKRZYSKIE;Kielce;Kielce;gmina miejska;kielce;miasto;ul juliusza slowackiego 5;"=""5""";"=""25-365""";78.0;78.0;100.0;78.0;;100.0;78.62820513;79.0;;;69.0;69.0;100.0;69.0;;100.0;75.30434783;77.0;122.81666666666666;125.5;63.0;64.0;98.4375;64.0;1.0;100.0;73.296875;77.5;142.8625;142.825;Tak;Dzieci lub młodzież;2003.09.29;2004.09.01;;312.0;;angielski, francuski, łacina, niemiecki, włoski;Tak;Tak;Tak;ogólnodostępny;
3099;lo;LICEUM OGÓLNOKSZTAŁCĄCE Z ODDZIAŁAMI INTEGRACYJNYMI;publiczna;ZACHODNIOPOMORSKIE;Szczecin;Szczecin;gmina miejska;szczecin;miasto;al wojska polskiego 119;"=""119""";"=""70-490""";59.0;61.0;96.72131148;61.0;;100.0;61.06557377;60.0;115.89999999999999;112.3;43.0;48.0;89.58333333;48.0;;100.0;64.9375;67.0;107.7125;102.925;48.0;54.0;88.88888889;54.0;;100.0;60.12962963;62.0;106.40625;109.475;Tak;Dzieci lub młodzież;1991.08.31;1991.08.31;;415.0;bieżnie proste, skocznie, rzutnie, inne urządzenia sportowe, boiska uniwersalne/wielozadaniowe;angielski, niemiecki, włoski;Nie;Tak;Tak;integracyjny;
3620;xlogdynskichnauczycielibohaterowiiwojnyswiatowej;X LICEUM OGÓLNOKSZTAŁCĄCE IM. GDYŃSKICH NAUCZYCIELI BOHATERÓW II WOJNY ŚWIATOWEJ;publiczna;POMORSKIE;Gdynia;Gdynia;gmina miejska;gdynia;miasto;ul wladyslawa iv 58;"=""58""";"=""81-384""";122.0;122.0;100.0;122.0;1.0;100.0;66.68032787;67.0;165.75;167.15;93.0;93.0;100.0;93.0;;100.0;76.43478261;78.0;154.20833333333334;159.425;123.0;123.0;100.0;123.0;;100.0;70.49593496;72.0;160.87142857142857;162.4;Tak;Dzieci lub młodzież;1992.08.31;1992.08.31;;474.0;boiska do koszykówki, boiska do piłki ręcznej;angielski, hiszpański, niemiecki, rosyjski;Nie;Tak;Tak;ogólnodostępny;
3640;vilowaclawasierpinskiego;VI LICEUM OGÓLNOKSZTAŁCĄCE IM. WACŁAWA SIERPIŃSKIEGO;publiczna;POMORSKIE;Gdynia;Gdynia;gmina miejska;gdynia;miasto;ul mikolaja kopernika 34;"=""34""";"=""81-424""";160.0;160.0;100.0;160.0;1.0;100.0;69.7;68.0;165.61;164.55;123.0;123.0;100.0;123.0;1.0;100.0;76.40983607;77.0;163.775;163.075;121.0;121.0;100.0;121.0;;100.0;76.10743802;77.0;168.16875;167.75;Tak;Dzieci lub młodzież;1972.04.25;1972.08.31;;572.0;boiska do siatkówki, bieżnie proste, skocznie, rzutnie, boiska uniwersalne/wielozadaniowe;angielski, francuski, hiszpański, niemiecki;Nie;Tak;Tak;ogólnodostępny;
3893;iiilomikolajakopernika;III LICEUM OGÓLNOKSZTAŁCĄCE IM. MIKOŁAJA KOPERNIKA;publiczna;ZACHODNIOPOMORSKIE;Szczecin;Szczecin;gmina miejska;szczecin;miasto;ul pomorska 150;"=""150""";"=""70-812""";95.0;96.0;98.95833333;96.0;;100.0;67.55208333;68.0;109.85833333333333;108.675;52.0;52.0;100.0;52.0;;100.0;70.71153846;70.0;101.425;101.425;88.0;88.0;100.0;88.0;;100.0;65.23863636;65.0;117.43333333333334;115.0;Tak;Dzieci lub młodzież;1946.08.24;1946.08.31;;513.0;boiska do piłki nożnej, bieżnie okólne, boiska uniwersalne/wielozadaniowe;angielski, niemiecki;Nie;Tak;Tak;ogólnodostępny;
3904;viiiloolimpijczykowpolskich;VIII LICEUM OGÓLNOKSZTAŁCĄCE IM. OLIMPIJCZYKÓW POLSKICH;publiczna;ZACHODNIOPOMORSKIE;Szczecin;Szczecin;gmina miejska;szczecin;miasto;ul andrzeja malkowskiego 12;"=""12""";"=""70-306""";36.0;41.0;87.80487805;41.0;;95.12195122;56.70731707;55.0;84.67999999999999;87.8;34.0;38.0;89.47368421;38.0;;100.0;56.86842105;58.0;99.05000000000001;99.05000000000001;63.0;87.0;72.4137931;87.0;;97.70114943;57.86206897;58.0;103.475;103.475;Tak;Dzieci lub młodzież;1971.08.31;1971.08.31;Zespół szkół i placówek oświatowych;330.0;;angielski, niemiecki;Nie;Tak;Tak;ogólnodostępny, integracyjny;
3957;ixlomarszalkajozefapilsudskiego;IX LICEUM OGÓLNOKSZTAŁCĄCE IM. MARSZAŁKA JÓZEFA PIŁSUDSKIEGO;publiczna;POMORSKIE;Gdynia;Gdynia;gmina miejska;gdynia;miasto;ul orlowska 57;"=""57""";"=""81-542""";220.0;222.0;99.0990991;222.0;;100.0;66.33484163;67.0;134.44166666666666;135.225;173.0;174.0;99.42528736;174.0;;100.0;69.54597701;71.0;134.275;131.125;138.0;139.0;99.28057554;139.0;;100.0;64.1294964;63.0;148.45000000000002;147.575;Tak;Dzieci lub młodzież;1991.08.31;1991.08.31;;719.0;boiska uniwersalne/wielozadaniowe;angielski, hiszpański, niemiecki;Nie;Nie;Nie;ogólnodostępny;
3963;ilomsklodowskiejcurie;I LICEUM OGÓLNOKSZTAŁCĄCE IM. M. SKŁODOWSKIEJ CURIE;publiczna;ZACHODNIOPOMORSKIE;Szczecin;Szczecin;gmina miejska;szczecin;miasto;al piastow 12;"=""12""";"=""70-331""";212.0;214.0;99.06542056;214.0;;100.0;70.18224299;70.0;152.68333333333334;153.0;177.0;177.0;100.0;177.0;;100.0;73.67613636;75.0;152.48;150.7;213.0;213.0;100.0;213.0;;100.0;77.31455399;78.0;154.68333333333334;155.65;Tak;Dzieci lub młodzież;1945.08.31;1945.08.31;;1036.0;boiska do piłki ręcznej, bieżnie proste, skocznie, inne urządzenia sportowe, boiska uniwersalne/wielozadaniowe;angielski, niemiecki, włoski;Nie;Tak;Tak;ogólnodostępny;
3966;vilostefanaczarnieckiego;VI LICEUM OGÓLNOKSZTAŁCĄCE IM. STEFANA CZARNIECKIEGO;publiczna;ZACHODNIOPOMORSKIE;Szczecin;Szczecin;gmina miejska;szczecin;miasto;ul jagiellonska 41;"=""41""";"=""70-382""";118.0;118.0;100.0;118.0;;100.0;70.12711864;72.0;139.80714285714285;141.65;92.0;92.0;100.0;92.0;;100.0;74.90217391;77.0;136.76666666666668;140.9;114.0;114.0;100.0;114.0;;100.0;70.76315789;72.0;149.27499999999998;150.02499999999998;Tak;Dzieci lub młodzież;1949.08.31;1949.08.31;;652.0;inne urządzenia sportowe, boiska uniwersalne/wielozadaniowe;angielski, niemiecki;Nie;Tak;Tak;ogólnodostępny;
3974;xvlortmwitoldapileckiego;XV LICEUM OGÓLNOKSZTAŁCĄCE IM. RTM. WITOLDA PILECKIEGO;publiczna;ŚLĄSKIE;Katowice;Katowice;gmina miejska;katowice;miasto;ul obroki 87;"=""87""";"=""40-833""";26.0;37.0;70.27027027;38.0;;75.67567568;42.81578947;47.5;50.0;50.0;22.0;33.0;66.66666667;33.0;;96.96969697;51.27272727;53.0;61.4;61.4;15.0;36.0;41.66666667;38.0;;77.77777778;44.71052632;50.0;;;Tak;Dzieci lub młodzież;2008.08.27;2008.08.31;;269.0;boiska do koszykówki, boiska do piłki ręcznej, boiska do piłki nożnej, bieżnie proste, skocznie, rzutnie;angielski, niemiecki;Nie;Tak;Tak;ogólnodostępny, przygotowania wojskowego, profil mundurowy;
4043;iiilocyprianakamilanorwidawkielcach;III LICEUM OGÓLNOKSZTAŁCĄCE Z ODDZIAŁAMI INTEGRACYJNYMI IM. CYPRIANA KAMILA NORWIDA W KIELCACH;publiczna;ŚWIĘTOKRZYSKIE;Kielce;Kielce;gmina miejska;kielce;miasto;ul jagiellonska 4;"=""4""";"=""25-613""";165.0;167.0;98.80239521;167.0;;99.4011976;65.33939394;67.0;;;187.0;188.0;99.46808511;188.0;;99.46808511;66.85638298;67.0;147.01;146.6;170.0;170.0;100.0;170.0;;100.0;67.56470588;68.0;143.8;144.125;Tak;Dzieci lub młodzież;1966.06.30;1966.06.30;;852.0;inne urządzenia sportowe, boiska uniwersalne/wielozadaniowe;angielski, francuski, hiszpański, niemiecki, rosyjski, włoski;Nie;Tak;Tak;ogólnodostępny, integracyjny, dwujęzyczny w szkole podstawowej, liceum i technikum;
4045;iakademickielozasluzonychludzimorza;I AKADEMICKIE LICEUM OGÓLNOKSZTAŁCĄCE IM. ZASŁUŻONYCH LUDZI MORZA;publiczna;POMORSKIE;Gdynia;Gdynia;gmina miejska;gdynia;miasto;ul narcyzowa 6;"=""6""";"=""81-653""";113.0;113.0;100.0;113.0;;100.0;69.08849558;70.0;155.74;156.65;115.0;115.0;100.0;115.0;;100.0;69.96521739;70.0;130.74;116.7;73.0;74.0;98.64864865;74.0;;100.0;70.78378378;72.0;155.17857142857142;157.7;Tak;Dzieci lub młodzież;1948.08.31;1948.08.31;;513.0;boiska do piłki ręcznej, bieżnie proste, skocznie, rzutnie, boiska uniwersalne/wielozadaniowe;angielski, hiszpański, niemiecki;Tak;Tak;Tak;ogólnodostępny;
4434;xxilostanislawaignacegowitkiewiczawitkacegowkrakowie;XXI LICEUM OGÓLNOKSZTAŁCĄCE IM. STANISŁAWA IGNACEGO WITKIEWICZA-WITKACEGO W KRAKOWIE;publiczna;MAŁOPOLSKIE;Kraków;Kraków-Nowa Huta;gmina miejska;krakow nowa huta;delegatura;os osiedle tysiaclecia 15;"=""15""";"=""31-606""";18.0;18.0;100.0;18.0;;100.0;79.44444444;82.0;51.1;51.1;13.0;14.0;92.85714286;14.0;;100.0;65.0;65.0;;;28.0;32.0;87.5;32.0;;100.0;70.6875;70.0;69.55000000000001;69.55000000000001;Tak;Dzieci lub młodzież;1991.06.14;1991.09.01;;143.0;;angielski, hiszpański, włoski;Nie;Nie;Tak;ogólnodostępny;
4435;xlokomisjiedukacjinarodowejwkrakowie;X LICEUM OGÓLNOKSZTAŁCĄCE IM. KOMISJI EDUKACJI NARODOWEJ W KRAKOWIE;publiczna;MAŁOPOLSKIE;Kraków;Kraków-Śródmieście;gmina miejska;krakow srodmiescie;delegatura;ul zygmunta wroblewskiego 8;"=""8""";"=""31-148""";189.0;189.0;100.0;189.0;;100.0;76.75132275;77.0;168.92142857142858;169.25;177.0;177.0;100.0;177.0;;100.0;74.50847458;75.0;164.04166666666666;165.125;190.0;190.0;100.0;190.0;;100.0;76.7;77.0;168.6916666666667;169.3;Tak;Dzieci lub młodzież;1953.06.20;1953.09.01;;758.0;boiska do piłki nożnej;angielski, francuski, hiszpański, niemiecki, rosyjski;Nie;Tak;Tak;ogólnodostępny;
4577;vilojuliuszaslowackiegowkielcach;VI LICEUM OGÓLNOKSZTAŁCĄCE IM. JULIUSZA SŁOWACKIEGO W KIELCACH;publiczna;ŚWIĘTOKRZYSKIE;Kielce;Kielce;gmina miejska;kielce;miasto;ul majora jurija gagarina 5;"=""5""";"=""25-031""";223.0;223.0;100.0;223.0;5.0;100.0;70.31531532;70.0;;;153.0;153.0;100.0;153.0;;100.0;73.18954248;75.0;157.07999999999998;157.85;204.0;204.0;100.0;204.0;1.0;100.0;69.75980392;70.0;159.6;159.0;Tak;Dzieci lub młodzież;1960.08.18;1960.09.01;;1058.0;;angielski, francuski, hiszpański, niemiecki, rosyjski;Nie;Tak;Tak;ogólnodostępny, międzynarodowy, dwujęzyczny w szkole podstawowej, liceum i technikum;
4648;xvilokrzysztofakamilabaczynskiegowkrakowie;XVI LICEUM OGÓLNOKSZTAŁCĄCE IM. KRZYSZTOFA KAMILA BACZYŃSKIEGO W KRAKOWIE;publiczna;MAŁOPOLSKIE;Kraków;Kraków-Nowa Huta;gmina miejska;krakow nowa huta;delegatura;os osiedle willowe 1;"=""1""";"=""31-901""";111.0;116.0;95.68965517;117.0;;99.13793103;65.22222222;67.0;;;103.0;113.0;91.15044248;113.0;;97.34513274;65.80530973;68.0;77.16666666666667;77.85;108.0;114.0;94.73684211;114.0;;99.12280702;54.94690265;57.0;105.49000000000001;116.8;Tak;Dzieci lub młodzież;1971.06.20;1971.09.01;;510.0;boiska do siatkówki, boiska do koszykówki, boiska do piłki ręcznej;angielski, hiszpański, niemiecki, włoski;Nie;Tak;Tak;ogólnodostępny, przygotowania wojskowego;
4735;vloaugustawitkowskiegowkrakowie;V LICEUM OGÓLNOKSZTAŁCĄCE IM. AUGUSTA WITKOWSKIEGO W KRAKOWIE;publiczna;MAŁOPOLSKIE;Kraków;Kraków-Śródmieście;gmina miejska;krakow srodmiescie;delegatura;ul studencka 12;"=""12""";"=""31-116""";249.0;249.0;100.0;249.0;2.0;100.0;83.3935743;87.0;179.3;179.14999999999998;226.0;226.0;100.0;226.0;1.0;100.0;82.34375;85.0;171.65;173.25;240.0;240.0;100.0;240.0;9.0;100.0;81.17083333;83.0;180.08125;179.925;Tak;Dzieci lub młodzież;1871.09.01;1871.09.01;;948.0;;angielski, francuski, hiszpański, niemiecki, rosyjski, włoski;Nie;Tak;Tak;ogólnodostępny;
4748;vlokspiotrasciegiennegowkielcach;V LICEUM OGÓLNOKSZTAŁCĄCE IM. KS. PIOTRA ŚCIEGIENNEGO W KIELCACH;publiczna;ŚWIĘTOKRZYSKIE;Kielce;Kielce;gmina miejska;kielce;miasto;ul marszalkowska 96;"=""96""";"=""25-549""";204.0;205.0;99.51219512;205.0;1.0;99.51219512;64.89268293;65.0;;;153.0;154.0;99.35064935;154.0;;100.0;64.99350649;65.0;130.51250000000002;132.3;184.0;185.0;99.45945946;185.0;;99.45945946;65.07567568;67.0;137.475;136.7;Tak;Dzieci lub młodzież;1966.07.01;1966.09.01;;852.0;;angielski, francuski, hiszpański, niemiecki, rosyjski;Nie;Tak;Tak;ogólnodostępny;
4881;ixlozygmuntawroblewskiegowkrakowie;IX LICEUM OGÓLNOKSZTAŁCĄCE IM. ZYGMUNTA WRÓBLEWSKIEGO W KRAKOWIE;publiczna;MAŁOPOLSKIE;Kraków;Kraków-Krowodrza;gmina miejska;krakow krowodrza;delegatura;ul kazimierza czapinskiego 5;"=""5""";"=""30-048""";121.0;122.0;99.18032787;122.0;;100.0;70.23770492;70.0;158.66;154.75;126.0;126.0;100.0;126.0;;100.0;67.58730159;68.0;149.175;149.35000000000002;125.0;125.0;100.0;125.0;;100.0;72.792;75.0;163.3625;165.075;Tak;Dzieci lub młodzież;1958.09.02;1958.09.02;;493.0;boiska do siatkówki, boiska do koszykówki;angielski, francuski, niemiecki, włoski;Nie;Tak;Tak;ogólnodostępny;
5366;ivlocyprianakamilanorwidawbialymstoku;IV LICEUM OGÓLNOKSZTAŁCĄCE IM. CYPRIANA KAMILA NORWIDA W BIAŁYMSTOKU;publiczna;PODLASKIE;Białystok;Białystok;gmina miejska;bialystok;miasto;ul zwierzyniecka 9a;"=""9A""";"=""15-312""";240.0;240.0;100.0;240.0;1.0;100.0;73.16666667;73.0;;;224.0;226.0;99.11504425;226.0;1.0;99.55752212;69.82743363;72.0;154.175;155.275;229.0;229.0;100.0;229.0;;100.0;63.36681223;63.0;131.93055555555554;160.675;Tak;Dzieci lub młodzież;1971.06.11;1971.09.01;;987.0;bieżnie proste, boiska uniwersalne/wielozadaniowe;angielski, francuski, hiszpański, łacina, niemiecki, rosyjski;Nie;Tak;Nie;ogólnodostępny, sportowy;
5438;iilomariikonopnickiej;II LICEUM OGÓLNOKSZTAŁCĄCE Z ODDZIAŁAMI DWUJĘZYCZNYMI IM. MARII KONOPNICKIEJ;publiczna;ŚLĄSKIE;Katowice;Katowice;gmina miejska;katowice;miasto;ul bartosza glowackiego 6;"=""4-6""";"=""40-052""";228.0;228.0;100.0;228.0;;100.0;73.12280702;73.0;166.46428571428572;163.0;213.0;213.0;100.0;213.0;;100.0;82.08450704;83.0;;;215.0;216.0;99.53703704;216.0;1.0;100.0;68.22222222;68.0;;;Tak;Dzieci lub młodzież;2010.09.01;2010.09.01;;963.0;boiska uniwersalne/wielozadaniowe;angielski, hiszpański, niemiecki;Nie;Tak;Tak;ogólnodostępny, dwujęzyczny w szkole podstawowej, liceum i technikum;
5448;iilojanasniadeckiegowkielcach;II LICEUM OGÓLNOKSZTAŁCĄCE IM. JANA ŚNIADECKIEGO W KIELCACH;publiczna;ŚWIĘTOKRZYSKIE;Kielce;Kielce;gmina miejska;kielce;miasto;ul jana i jedrzeja sniadeckich 9;"=""9""";"=""25-366""";232.0;232.0;100.0;232.0;;100.0;69.32327586;72.0;;;203.0;203.0;100.0;203.0;;100.0;73.1773399;73.0;156.05;164.85;228.0;228.0;100.0;228.0;;100.0;73.54185022;73.0;161.82857142857142;162.9;Tak;Dzieci lub młodzież;1958.09.01;1958.09.01;;1099.0;;angielski, francuski, łacina, niemiecki, rosyjski;Nie;Tak;Tak;ogólnodostępny, dwujęzyczny w szkole podstawowej, liceum i technikum;
5449;iiiloadamamickiewicza;III LICEUM OGÓLNOKSZTAŁCĄCE IM. ADAMA MICKIEWICZA;publiczna;ŚLĄSKIE;Katowice;Katowice;gmina miejska;katowice;miasto;ul adama mickiewicza 11;"=""11""";"=""40-092""";135.0;135.0;100.0;135.0;1.0;100.0;86.11851852;88.0;169.57500000000002;170.95;145.0;145.0;100.0;145.0;;100.0;77.09655172;78.0;149.96666666666667;154.2;169.0;169.0;100.0;169.0;1.0;100.0;73.40236686;75.0;;;Tak;Dzieci lub młodzież;2002.09.01;2002.09.01;;760.0;boiska do siatkówki, boiska do koszykówki, boiska uniwersalne/wielozadaniowe;angielski, francuski, hiszpański, niemiecki, włoski;Nie;Tak;Tak;ogólnodostępny, międzynarodowy;
5668;ivlogeneralastanislawamaczka;IV LICEUM OGÓLNOKSZTAŁCĄCE IM. GENERAŁA STANISŁAWA MACZKA;publiczna;ŚLĄSKIE;Katowice;Katowice;gmina miejska;katowice;miasto;ul katowicka 54;"=""54""";"=""40-165""";111.0;111.0;100.0;111.0;;100.0;82.63063063;83.0;166.03333333333333;162.1;137.0;137.0;100.0;137.0;;100.0;68.94160584;70.0;144.57999999999998;146.75;167.0;168.0;99.4047619;168.0;;100.0;63.3452381;63.0;;;Tak;Dzieci lub młodzież;2002.09.01;2002.09.01;;533.0;boiska uniwersalne/wielozadaniowe;angielski, hiszpański, niemiecki, włoski;Nie;Tak;Tak;ogólnodostępny;
5738;vlowladyslawabroniewskiego;V LICEUM OGÓLNOKSZTAŁCĄCE IM. WŁADYSŁAWA BRONIEWSKIEGO;publiczna;ŚLĄSKIE;Katowice;Katowice;gmina miejska;katowice;miasto;ul gen zygmunta waltera jankego 65;"=""65""";"=""40-615""";67.0;83.0;80.72289157;83.0;;100.0;57.14457831;57.0;101.06666666666666;101.45;37.0;46.0;80.43478261;47.0;;100.0;68.97826087;71.0;106.55;106.55;52.0;56.0;92.85714286;57.0;;100.0;63.64912281;62.0;;;Tak;Dzieci lub młodzież;2002.09.01;2002.09.01;Zespół szkół i placówek oświatowych;161.0;;angielski, niemiecki, włoski;Nie;Nie;Nie;ogólnodostępny;
5756;ilostefanazeromskiegowkielcach;I LICEUM OGÓLNOKSZTAŁCĄCE IM. STEFANA ŻEROMSKIEGO W KIELCACH;publiczna;ŚWIĘTOKRZYSKIE;Kielce;Kielce;gmina miejska;kielce;miasto;ul ksiedza piotra sciegiennego 15;"=""15""";"=""25-033""";199.0;199.0;100.0;199.0;;100.0;71.69346734;73.0;;;190.0;190.0;100.0;190.0;;100.0;73.82105263;75.0;162.8375;164.225;186.0;186.0;100.0;186.0;1.0;100.0;75.93010753;77.0;155.225;156.875;Tak;Dzieci lub młodzież;1724.04.25;1727.09.04;;825.0;boiska do siatkówki;angielski, hiszpański, niemiecki;Nie;Tak;Tak;ogólnodostępny;
6934;xvlozjednoczonejeuropywgdansku;XV LICEUM OGÓLNOKSZTAŁCĄCE Z ODDZIAŁAMI DWUJĘZYCZNYMI IM. ZJEDNOCZONEJ EUROPY W GDAŃSKU;publiczna;POMORSKIE;Gdańsk;Gdańsk;gmina miejska;gdansk;miasto;ul pilotow 7;"=""7""";"=""80-460""";137.0;137.0;100.0;137.0;;100.0;65.32116788;65.0;158.14000000000001;156.5;152.0;152.0;100.0;152.0;;100.0;63.24503311;62.0;144.89000000000001;144.05;159.0;162.0;98.14814815;162.0;;100.0;65.24223602;65.0;148.45714285714286;148.9;Tak;Dzieci lub młodzież;1991.09.01;1991.09.01;;878.0;bieżnie okólne, inne urządzenia sportowe, boiska uniwersalne/wielozadaniowe;angielski, hiszpański, niemiecki;Nie;Nie;Tak;ogólnodostępny, dwujęzyczny w szkole podstawowej, liceum i technikum;
6954;xixlomarianamokwywgdansku;XIX LICEUM OGÓLNOKSZTAŁCĄCE IM. MARIANA MOKWY W GDAŃSKU;publiczna;POMORSKIE;Gdańsk;Gdańsk;gmina miejska;gdansk;miasto;ul jana pestalozziego 11 13;"=""11/13""";"=""80-445""";167.0;167.0;100.0;167.0;;100.0;69.56024096;71.0;167.74166666666667;168.325;155.0;156.0;99.35897436;156.0;;99.35897436;71.56862745;72.0;158.87142857142857;159.45;149.0;149.0;100.0;149.0;;100.0;67.14189189;67.0;158.52857142857144;161.9;Tak;Dzieci lub młodzież;1992.09.01;1992.09.01;;634.0;boiska do piłki nożnej, boiska uniwersalne/wielozadaniowe;angielski, francuski, niemiecki, rosyjski;Nie;Tak;Nie;ogólnodostępny;
7000;vloadamaasnyka;V LICEUM OGÓLNOKSZTAŁCĄCE Z ODDZIAŁAMI DWUJĘZYCZNYMI IM. ADAMA ASNYKA;publiczna;ZACHODNIOPOMORSKIE;Szczecin;Szczecin;gmina miejska;szczecin;miasto;ul ofiar oswiecimia 14;"=""14""";"=""71-537""";115.0;115.0;100.0;115.0;;100.0;80.05217391;82.0;172.8166666666667;167.75;128.0;128.0;100.0;128.0;;100.0;79.6484375;82.0;172.725;172.075;116.0;116.0;100.0;116.0;1.0;100.0;75.74137931;77.0;171.4625;171.375;Tak;Dzieci lub młodzież;1948.09.01;1948.09.01;;608.0;boiska do piłki nożnej, skocznie, inne urządzenia sportowe, boiska uniwersalne/wielozadaniowe;angielski, niemiecki;Nie;Tak;Tak;ogólnodostępny, dwujęzyczny w szkole podstawowej, liceum i technikum;
7051;vlostefanazeromskiegowgdansku;V LICEUM OGÓLNOKSZTAŁCĄCE IM. STEFANA ŻEROMSKIEGO W GDAŃSKU;publiczna;POMORSKIE;Gdańsk;Gdańsk;gmina miejska;gdansk;miasto;ul polanki 130;"=""130""";"=""80-322""";120.0;120.0;100.0;120.0;3.0;100.0;74.08333333;75.0;173.926;174.05;142.0;142.0;100.0;142.0;1.0;100.0;75.46478873;77.0;168.60999999999999;169.5;150.0;150.0;100.0;150.0;1.0;100.0;70.86666667;72.0;171.58714285714288;171.85;Tak;Dzieci lub młodzież;1965.04.17;1965.09.01;;564.0;skocznie, rzutnie, boiska uniwersalne/wielozadaniowe;angielski, hiszpański, niemiecki;Nie;Tak;Tak;ogólnodostępny, dwujęzyczny w szkole podstawowej, liceum i technikum;
7099;ogolnoksztalcacych13iiilobohaterowwesterplattewgdansku;ZESPÓŁ SZKÓŁ OGÓLNOKSZTAŁCĄCYCH NR 13 III LICEUM OGÓLNOKSZTAŁCĄCE Z ODDZIAŁAMI DWUJĘZYCZNYMI IM. BOHATERÓW WESTERPLATTE W GDAŃSKU;publiczna;POMORSKIE;Gdańsk;Gdańsk;gmina miejska;gdansk;miasto;ul topolowa 7;"=""7""";"=""80-255""";111.0;111.0;100.0;111.0;;100.0;69.82727273;72.0;;;91.0;91.0;100.0;91.0;1.0;100.0;75.13186813;75.0;162.22750000000002;162.81;113.0;113.0;100.0;113.0;1.0;100.0;75.86725664;77.0;167.43333333333334;166.74;Tak;Dzieci lub młodzież;1950.09.01;1950.09.01;;697.0;boiska uniwersalne/wielozadaniowe;angielski, francuski, hiszpański, niemiecki;Nie;Tak;Tak;ogólnodostępny, międzynarodowy, dwujęzyczny w szkole podstawowej, liceum i technikum;
7670;ilomikolajakopernika;I LICEUM OGÓLNOKSZTAŁCĄCE IM. MIKOŁAJA KOPERNIKA;publiczna;KUJAWSKO-POMORSKIE;Toruń;Toruń;gmina miejska;torun;miasto;ul zaulek prosowy 1;"=""1""";"=""87-100""";160.0;160.0;100.0;160.0;;100.0;74.25;77.0;173.74;174.85;159.0;159.0;100.0;159.0;;100.0;77.95597484;78.0;163.15;162.075;162.0;162.0;100.0;162.0;1.0;100.0;76.04938272;77.0;164.34;159.4;Tak;Dzieci lub młodzież;1975.12.15;1975.12.15;;731.0;boiska uniwersalne/wielozadaniowe;angielski, francuski, hiszpański, niemiecki;Nie;Tak;Tak;ogólnodostępny;
7709;xxviiilowojciechabednarskiegowkrakowie;XXVIII LICEUM OGÓLNOKSZTAŁCĄCE IM. WOJCIECHA BEDNARSKIEGO W KRAKOWIE;publiczna;MAŁOPOLSKIE;Kraków;Kraków-Podgórze;gmina miejska;krakow podgorze;delegatura;ul tadeusza czackiego 11;"=""11""";"=""30-501""";90.0;91.0;98.9010989;92.0;;98.9010989;64.48913043;67.0;145.775;145.825;97.0;100.0;97.0;100.0;;99.0;61.8989899;62.0;123.14999999999999;114.75;71.0;73.0;97.26027397;73.0;;97.26027397;58.43835616;60.0;146.5125;146.525;Tak;Dzieci lub młodzież;1992.06.17;1992.09.01;;415.0;;angielski, francuski, hiszpański, niemiecki;Nie;Tak;Tak;ogólnodostępny;
7713;ilobartlomiejanowodworskiegowkrakowie;I LICEUM OGÓLNOKSZTAŁCĄCE IM. BARTŁOMIEJA NOWODWORSKIEGO W KRAKOWIE;publiczna;MAŁOPOLSKIE;Kraków;Kraków-Śródmieście;gmina miejska;krakow srodmiescie;delegatura;pl plac na groblach 9;"=""9""";"=""31-101""";177.0;177.0;100.0;177.0;;100.0;77.05142857;78.0;169.17499999999998;170.5;183.0;184.0;99.45652174;184.0;2.0;100.0;79.13114754;80.0;167.69;168.8;197.0;197.0;100.0;197.0;;100.0;81.01522843;83.0;173.02857142857144;173.95;Tak;Dzieci lub młodzież;1586.05.05;1588.06.01;;824.0;;angielski, francuski, łacina, niemiecki, rosyjski, włoski, grecki;Nie;Tak;Tak;ogólnodostępny;
7753;ilomikolajakopernikawgdansku;I LICEUM OGÓLNOKSZTAŁCĄCE IM. MIKOŁAJA KOPERNIKA W GDAŃSKU;publiczna;POMORSKIE;Gdańsk;Gdańsk;gmina miejska;gdansk;miasto;ul waly piastowskie 6;"=""6""";"=""80-855""";149.0;149.0;100.0;149.0;;100.0;73.09395973;73.0;172.48333333333335;173.25;135.0;135.0;100.0;135.0;1.0;100.0;73.72592593;73.0;164.14000000000001;165.2;167.0;167.0;100.0;167.0;;100.0;77.38922156;78.0;168.85999999999999;169.3;Tak;Dzieci lub młodzież;1945.05.08;1945.05.08;;660.0;boiska do koszykówki, bieżnie proste, skocznie, inne urządzenia sportowe, boiska uniwersalne/wielozadaniowe;angielski, francuski, niemiecki;Nie;Tak;Tak;ogólnodostępny;
7863;xlojozefawybickiego;X LICEUM OGÓLNOKSZTAŁCĄCE MISTRZOSTWA SPORTOWEGO IM. JÓZEFA WYBICKIEGO;publiczna;ŚWIĘTOKRZYSKIE;Kielce;Kielce;gmina miejska;kielce;miasto;ul jagiellonska 90;"=""90""";"=""25-734""";70.0;92.0;76.08695652;92.0;;83.69565217;48.95604396;50.0;;;68.0;77.0;88.31168831;77.0;;97.4025974;53.71428571;57.0;146.2375;147.8;71.0;81.0;87.65432099;82.0;;96.2962963;56.80487805;60.0;146.3;136.575;Tak;Dzieci lub młodzież;2002.06.06;2002.09.01;Zespół szkół i placówek oświatowych;672.0;;angielski, hiszpański, niemiecki, rosyjski;Nie;Tak;Tak;ogólnodostępny, sportowy, mistrzostwa sportowego, profil mundurowy;
7983;xxilo;XXI LICEUM OGÓLNOKSZTAŁCĄCE Z ODDZIAŁAMI SPORTOWYMI;publiczna;POMORSKIE;Gdańsk;Gdańsk;gmina miejska;gdansk;miasto;ul kolobrzeska 77;"=""77""";"=""80-396""";57.0;69.0;82.60869565;69.0;;94.20289855;51.37681159;53.0;117.4375;116.55;54.0;60.0;90.0;60.0;;100.0;55.25423729;55.0;67.675;69.35;49.0;69.0;71.01449275;69.0;;86.95652174;46.84057971;48.0;86.4375;99.05000000000001;Tak;Dzieci lub młodzież;2002.09.01;2002.09.01;;454.0;boiska do koszykówki, boiska do piłki nożnej;angielski, niemiecki;Nie;Nie;Nie;ogólnodostępny, sportowy;
8286;ivlotadeuszakosciuszkiwkrakowie;IV LICEUM OGÓLNOKSZTAŁCĄCE IM. TADEUSZA KOŚCIUSZKI W KRAKOWIE;publiczna;MAŁOPOLSKIE;Kraków;Kraków-Podgórze;gmina miejska;krakow podgorze;delegatura;ul krzemionki 11;"=""11""";"=""30-525""";211.0;211.0;100.0;211.0;;100.0;73.49763033;73.0;170.08125;170.45;133.0;133.0;100.0;133.0;;100.0;73.54135338;75.0;163.52;168.25;170.0;170.0;100.0;170.0;2.0;100.0;66.69411765;65.0;169.9857142857143;171.05;Tak;Dzieci lub młodzież;1978.02.15;1978.09.01;;769.0;;angielski, francuski, hiszpański, niemiecki, rosyjski, włoski;Nie;Tak;Tak;ogólnodostępny;
8461;iiilosamuelabogumilalindego;III LICEUM OGÓLNOKSZTAŁCĄCE IM. SAMUELA BOGUMIŁA LINDEGO;publiczna;KUJAWSKO-POMORSKIE;Toruń;Toruń;gmina miejska;torun;miasto;ul leona raszei 1;"=""1""";"=""87-100""";154.0;162.0;95.0617284;162.0;;99.38271605;61.85802469;61.0;146.03571428571428;145.7;139.0;147.0;94.55782313;148.0;;99.31972789;66.46621622;67.0;79.825;78.7;156.0;159.0;98.11320755;159.0;;100.0;58.25157233;58.0;111.075;112.9;Tak;Dzieci lub młodzież;1975.12.15;1975.12.15;;826.0;boiska do siatkówki plażowej, boiska do koszykówki, boiska do piłki nożnej, boiska uniwersalne/wielozadaniowe;angielski, francuski, hiszpański, niemiecki, włoski;Nie;Tak;Tak;ogólnodostępny;
