27081;iilokrolajanaiiisobieskiegowkrakowie;II LICEUM OGÓLNOKSZTAŁCĄCE IM. KRÓLA JANA III SOBIESKIEGO W KRAKOWIE;publiczna;MAŁOPOLSKIE;Kraków;Kraków-Śródmieście;gmina miejska;krakow srodmiescie;delegatura;ul jana sobieskiego 9;"=""9""";"=""31-136""";249.0;249.0;100.0;249.0;;100.0;73.64257028;75.0;168.97777777777776;169.2;220.0;220.0;100.0;220.0;;100.0;78.89090909;80.0;163.9375;166.425;226.0;226.0;100.0;226.0;2.0;100.0;77.2079646;78.0;172.0125;172.64999999999998;Tak;Dzieci lub młodzież;1882.11.09;1882.11.09;;1008.0;boiska uniwersalne/wielozadaniowe;angielski, francuski, hiszpański, niemiecki;Nie;Tak;Tak;ogólnodostępny;
27158;lixlojanuszakusocinskiego;LIX LICEUM OGÓLNOKSZTAŁCĄCE MISTRZOSTWA SPORTOWEGO IM. JANUSZA KUSOCIŃSKIEGO;publiczna;MAZOWIECKIE;Warszawa;Bielany;gmina miejska;bielany;dzielnica m.st. Warszawy;ul samuela bogumila lindego 20;"=""20""";"=""01-952""";112.0;138.0;81.15942029;138.0;;96.37681159;57.47826087;59.0;;;116.0;129.0;89.92248062;130.0;;97.6744186;58.19230769;57.0;107.5;62.5;135.0;156.0;86.53846154;157.0;;98.07692308;59.34394904;60.0;111.60789473684211;61.13;Tak;Dzieci lub młodzież;1979.06.30;1979.09.01;;705.0;boiska do koszykówki, boiska do piłki nożnej, bieżnie proste, bieżnie okólne, skocznie, inne urządzenia sportowe;angielski, hiszpański, niemiecki;Nie;Tak;Tak;ogólnodostępny, mistrzostwa sportowego;
27280;lxlowojciechagorskiego;LX LICEUM OGÓLNOKSZTAŁCĄCE IM. WOJCIECHA GÓRSKIEGO;publiczna;MAZOWIECKIE;Warszawa;Bielany;gmina miejska;bielany;dzielnica m.st. Warszawy;ul lwa tolstoja 2;"=""2""";"=""01-910""";77.0;81.0;95.0617284;81.0;;98.7654321;56.90123457;58.0;125.21;124.9;66.0;71.0;92.95774648;71.0;;98.5915493;56.0;57.0;112.35;112.35;75.0;77.0;97.4025974;77.0;;100.0;59.5974026;60.0;123.60000000000001;122.1;Tak;Dzieci lub młodzież;1982.06.15;1982.09.01;Zespół szkół i placówek oświatowych;463.0;;angielski, hiszpański, niemiecki;Tak;Tak;Tak;ogólnodostępny;
27325;xliiloirenysendlerowej;XLII LICEUM OGÓLNOKSZTAŁCĄCE IM. IRENY SENDLEROWEJ;publiczna;ŁÓDZKIE;Łódź;Łódź-Bałuty;gmina miejska;lodz baluty;delegatura;ul stawowa 28;"=""28""";"=""91-358""";29.0;33.0;87.87878788;33.0;;90.90909091;44.72727273;47.0;40.69285714285714;40.65;38.0;44.0;86.36363636;45.0;;86.36363636;46.62222222;45.0;73.575;78.075;44.0;52.0;84.61538462;52.0;;96.15384615;53.38461538;51.0;54.85;57.2;Tak;Dzieci lub młodzież;1999.01.01;1999.01.01;;490.0;boiska do koszykówki, boiska do piłki nożnej;angielski, hiszpański, niemiecki;Nie;Tak;Tak;ogólnodostępny;
27378;xliiilojulianatuwima;XLIII LICEUM OGÓLNOKSZTAŁCĄCE IM. JULIANA TUWIMA;publiczna;ŁÓDZKIE;Łódź;Łódź-Górna;gmina miejska;lodz gorna;delegatura;ul krolewska 13 15;"=""13/15""";"=""93-319""";29.0;40.0;72.5;40.0;;90.0;51.425;55.0;46.705;39.15;38.0;49.0;77.55102041;49.0;;83.67346939;46.18367347;47.0;93.10000000000001;100.0;23.0;30.0;76.66666667;30.0;;96.66666667;50.9;50.0;69.16666666666667;57.65;Tak;Dzieci lub młodzież;1999.01.01;1999.01.01;;431.0;boiska do piłki ręcznej, bieżnie proste, rzutnie, inne urządzenia sportowe;angielski, hiszpański, niemiecki, rosyjski;Tak;Tak;Tak;ogólnodostępny, integracyjny, sportowy;
27812;lviiilokrzysztofakamilabaczynskiego;LVIII LICEUM OGÓLNOKSZTAŁCĄCE IM. KRZYSZTOFA KAMILA BACZYŃSKIEGO;publiczna;MAZOWIECKIE;Warszawa;Śródmieście;gmina miejska;srodmiescie;dzielnica m.st. Warszawy;ul gornoslaska 31;"=""31""";"=""00-432""";89.0;90.0;98.88888889;90.0;;100.0;63.61111111;61.0;141.54166666666666;141.475;74.0;75.0;98.66666667;75.0;;100.0;70.81081081;70.0;92.375;107.94999999999999;88.0;90.0;97.77777778;90.0;;100.0;73.01111111;75.0;132.025;134.77499999999998;Tak;Dzieci lub młodzież;1990.09.01;1990.09.01;Zespół szkół i placówek oświatowych;515.0;;angielski, hiszpański, niemiecki, włoski;Nie;Tak;Tak;ogólnodostępny;
27858;ixloklementynyhoffmanowej;IX LICEUM OGÓLNOKSZTAŁCĄCE IM. KLEMENTYNY HOFFMANOWEJ;publiczna;MAZOWIECKIE;Warszawa;Śródmieście;gmina miejska;srodmiescie;dzielnica m.st. Warszawy;ul hoza 88;"=""88""";"=""00-682""";272.0;272.0;100.0;272.0;;100.0;80.23161765;82.0;176.16363636363636;176.25;251.0;251.0;100.0;251.0;;100.0;86.07171315;87.0;177.57;176.3;273.0;273.0;100.0;273.0;1.0;100.0;83.28571429;85.0;176.86666666666667;177.1;Tak;Dzieci lub młodzież;1900.09.01;1900.09.01;;1165.0;;angielski, francuski, hiszpański, niemiecki, rosyjski;Nie;Tak;Tak;ogólnodostępny;
27918;xviiloandrzejafryczamodrzewskiego;XVII LICEUM OGÓLNOKSZTAŁCĄCE Z ODDZIAŁAMI DWUJĘZYCZNYMI IM. ANDRZEJA FRYCZA MODRZEWSKIEGO;publiczna;MAZOWIECKIE;Warszawa;Śródmieście;gmina miejska;srodmiescie;dzielnica m.st. Warszawy;ul elektoralna 5 7;"=""5/7""";"=""00-137""";95.0;95.0;100.0;95.0;;100.0;77.2;78.0;175.45714285714286;171.3;114.0;114.0;100.0;114.0;;100.0;80.16666667;82.0;153.925;154.35;134.0;134.0;100.0;134.0;;100.0;83.71641791;85.0;170.94;170.8;Tak;Dzieci lub młodzież;1960.09.01;1960.09.01;;657.0;boiska do siatkówki, boiska do koszykówki, boiska do piłki ręcznej, bieżnie proste, bieżnie okólne, skocznie, rzutnie;angielski, niemiecki;Nie;Tak;Tak;ogólnodostępny, dwujęzyczny w szkole podstawowej, liceum i technikum;
28516;xxxviilojaroslawadabrowskiego;XXXVII LICEUM OGÓLNOKSZTAŁCĄCE IM. JAROSŁAWA DĄBROWSKIEGO;publiczna;MAZOWIECKIE;Warszawa;Śródmieście;gmina miejska;srodmiescie;dzielnica m.st. Warszawy;ul swietokrzyska 1;"=""1""";"=""00-360""";147.0;147.0;100.0;147.0;;100.0;79.57142857;80.0;168.85714285714286;169.35;152.0;152.0;100.0;152.0;;100.0;84.33552632;85.0;165.52;166.1;141.0;141.0;100.0;141.0;;100.0;77.39007092;78.0;167.28;167.05;Tak;Dzieci lub młodzież;1951.09.01;1951.09.01;;727.0;boiska uniwersalne/wielozadaniowe;angielski, niemiecki, włoski;Nie;Tak;Nie;ogólnodostępny;
28520;xvilo;XVI LICEUM OGÓLNOKSZTAŁCĄCE;publiczna;ŚLĄSKIE;Katowice;Katowice;gmina miejska;katowice;miasto;ul mikolowska 131;"=""131""";"=""40-592""";16.0;17.0;94.11764706;17.0;;100.0;56.82352941;58.0;;;11.0;12.0;91.66666667;12.0;;91.66666667;60.25;67.0;62.0;62.0;12.0;12.0;100.0;12.0;;100.0;65.83333333;69.5;;;Tak;Dzieci lub młodzież;2002.05.27;2002.09.01;Zespół szkół i placówek oświatowych;165.0;;angielski, hiszpański, niemiecki;Nie;Tak;Tak;ogólnodostępny, sportowy;
28603;xilomikolajareja;XI LICEUM OGÓLNOKSZTAŁCĄCE IM. MIKOŁAJA REJA;publiczna;MAZOWIECKIE;Warszawa;Śródmieście;gmina miejska;srodmiescie;dzielnica m.st. Warszawy;pl plac stanislawa malachowskiego 1;"=""1""";"=""00-063""";118.0;118.0;100.0;118.0;;100.0;79.01694915;82.0;167.91666666666666;168.575;127.0;127.0;100.0;127.0;1.0;100.0;81.48412698;82.0;166.3;167.175;179.0;179.0;100.0;179.0;1.0;100.0;77.75418994;78.0;167.8;169.45;Tak;Dzieci lub młodzież;1906.09.01;1906.09.01;;631.0;boiska uniwersalne/wielozadaniowe;angielski, francuski, hiszpański, łacina, niemiecki;Nie;Tak;Nie;ogólnodostępny;
29142;xivlokazimierzawielkiego;XIV LICEUM OGÓLNOKSZTAŁCĄCE IM. KAZIMIERZA WIELKIEGO;publiczna;WIELKOPOLSKIE;Poznań;Poznań-Nowe Miasto;gmina miejska;poznan nowe miasto;delegatura;os piastowskie 106;"=""106""";"=""61-164""";166.0;167.0;99.4011976;168.0;;99.4011976;65.51785714;65.0;133.25;129.15;101.0;101.0;100.0;101.0;;100.0;66.75247525;68.0;120.88749999999999;126.975;110.0;110.0;100.0;111.0;;100.0;70.38738739;73.0;149.80714285714288;149.25;Tak;Dzieci lub młodzież;1990.09.01;1990.09.01;;779.0;boiska do siatkówki plażowej, boiska uniwersalne/wielozadaniowe;angielski, francuski, hiszpański, niemiecki, rosyjski, włoski, rumuński;Nie;Tak;Tak;ogólnodostępny;
29239;lxixlobohaterowpowstaniawarszawskiego1944wwarszawie;LXIX LICEUM OGÓLNOKSZTAŁCĄCE Z ODDZIAŁAMI INTEGRACYJNYMI IM. BOHATERÓW POWSTANIA WARSZAWSKIEGO 1944 W WARSZAWIE;publiczna;MAZOWIECKIE;Warszawa;Ochota;gmina miejska;ochota;dzielnica m.st. Warszawy;ul stanislawa skarzynskiego 8;"=""8""";"=""02-377""";75.0;77.0;97.4025974;77.0;;100.0;63.48051948;62.0;;;49.0;54.0;90.74074074;54.0;;100.0;64.7037037;63.5;119.80000000000001;117.875;76.0;79.0;96.20253165;79.0;;100.0;60.63291139;60.0;140.20999999999998;140.8;Tak;Dzieci lub młodzież;1996.06.24;1996.09.01;;504.0;boiska do koszykówki, boiska do piłki nożnej, bieżnie okólne, skocznie, rzutnie, inne urządzenia sportowe;angielski, hiszpański, niemiecki, rosyjski;Tak;Tak;Tak;ogólnodostępny, integracyjny, sportowy;
29583;iiilomarynarkiwojennejrpzoddz;III LICEUM OGÓLNOKSZTAŁCĄCE IM. MARYNARKI WOJENNEJ RP Z ODDZ. DWUJĘZYCZNYMI;publiczna;POMORSKIE;Gdynia;Gdynia;gmina miejska;gdynia;miasto;ul legionow 27;"=""27""";"=""81-405""";139.0;139.0;100.0;139.0;4.0;100.0;76.79856115;78.0;184.20833333333334;183.85000000000002;99.0;99.0;100.0;99.0;1.0;100.0;79.13131313;80.0;178.63333333333333;174.425;117.0;117.0;100.0;117.0;;100.0;80.28205128;82.0;188.1;189.2;Tak;Dzieci lub młodzież;1950.09.01;1950.09.01;;712.0;boiska do siatkówki, boiska do koszykówki, boiska do piłki ręcznej, skocznie;angielski, francuski, hiszpański, niemiecki;Nie;Tak;Tak;ogólnodostępny, międzynarodowy, dwujęzyczny w szkole podstawowej, liceum i technikum;
29625;xxvlogeneralowejjadwigizamoyskiej;XXV LICEUM OGÓLNOKSZTAŁCĄCE IM. GENERAŁOWEJ JADWIGI ZAMOYSKIEJ;publiczna;WIELKOPOLSKIE;Poznań;Poznań-Jeżyce;gmina miejska;poznan jezyce;delegatura;ul widna 1;"=""1""";"=""60-655""";129.0;130.0;99.23076923;130.0;;100.0;63.86821705;65.0;117.30625;115.175;97.0;98.0;98.97959184;98.0;;100.0;69.41836735;70.0;111.875;118.25;110.0;112.0;98.21428571;112.0;;100.0;70.49107143;71.0;134.025;133.9;Tak;Dzieci lub młodzież;1992.05.01;1992.09.01;;608.0;;angielski, hiszpański, niemiecki;Nie;Tak;Tak;ogólnodostępny, dwujęzyczny w szkole podstawowej, liceum i technikum;
29670;ixlokarolalibelta;IX LICEUM OGÓLNOKSZTAŁCĄCE IM. KAROLA LIBELTA;publiczna;WIELKOPOLSKIE;Poznań;Poznań-Stare Miasto;gmina miejska;poznan stare miasto;delegatura;ul warzywna 24;"=""24""";"=""61-658""";129.0;129.0;100.0;129.0;;100.0;75.296875;75.0;152.0;151.425;120.0;120.0;100.0;120.0;;100.0;75.33333333;75.0;150.52;153.3;123.0;123.0;100.0;123.0;;100.0;68.88617886;70.0;157.44166666666666;156.64999999999998;Tak;Dzieci lub młodzież;1952.09.01;1952.09.01;;678.0;boiska do siatkówki, boiska do koszykówki, boiska do piłki nożnej, bieżnie proste, skocznie;angielski, hiszpański, niemiecki, włoski;Nie;Tak;Tak;ogólnodostępny;
29919;xxvilowkrakowie;XXVI LICEUM OGÓLNOKSZTAŁCĄCE W KRAKOWIE;publiczna;MAŁOPOLSKIE;Kraków;Kraków-Śródmieście;gmina miejska;krakow srodmiescie;delegatura;ul krupnicza 44;"=""44""";"=""31-123""";52.0;53.0;98.11320755;53.0;;100.0;68.43396226;70.0;;;46.0;46.0;100.0;46.0;;100.0;71.45652174;72.0;;;85.0;85.0;100.0;85.0;;100.0;65.34117647;65.0;131.51666666666665;126.3;Tak;Dzieci lub młodzież;1992.04.14;1992.09.01;Zespół szkół i placówek oświatowych;322.0;;angielski, hiszpański, niemiecki;Nie;Tak;Tak;ogólnodostępny;
30251;xviiilojanazamoyskiego;XVIII LICEUM OGÓLNOKSZTAŁCĄCE IM. JANA ZAMOYSKIEGO;publiczna;MAZOWIECKIE;Warszawa;Śródmieście;gmina miejska;srodmiescie;dzielnica m.st. Warszawy;ul smolna 30;"=""30""";"=""00-375""";180.0;180.0;100.0;180.0;;100.0;81.98882682;82.0;172.30714285714288;173.3;174.0;174.0;100.0;174.0;;100.0;80.84482759;82.0;172.10999999999999;172.7;178.0;178.0;100.0;178.0;;100.0;82.06179775;83.0;172.38333333333333;173.3;Tak;Dzieci lub młodzież;1905.09.01;1905.09.01;;828.0;boiska do piłki ręcznej, boiska do piłki nożnej, bieżnie proste, boiska uniwersalne/wielozadaniowe;angielski, francuski, hiszpański, niemiecki;Nie;Tak;Nie;ogólnodostępny;
30253;lxviilojananowakajezioranskiego;LXVII LICEUM OGÓLNOKSZTAŁCĄCE IM. JANA NOWAKA-JEZIORAŃSKIEGO;publiczna;MAZOWIECKIE;Warszawa;Śródmieście;gmina miejska;srodmiescie;dzielnica m.st. Warszawy;ul hoza 11 15;"=""11/15""";"=""00-528""";111.0;111.0;100.0;111.0;1.0;100.0;77.22522523;78.0;171.1125;170.7;101.0;101.0;100.0;101.0;;100.0;77.76237624;80.0;170.725;171.575;105.0;105.0;100.0;105.0;;100.0;78.86666667;80.0;170.675;171.575;Tak;Dzieci lub młodzież;1991.09.01;1991.09.01;;571.0;;angielski, hiszpański, niemiecki;Nie;Tak;Nie;ogólnodostępny;
30254;lxxvlojanaiiisobieskiego;LXXV LICEUM OGÓLNOKSZTAŁCĄCE IM. JANA III SOBIESKIEGO;publiczna;MAZOWIECKIE;Warszawa;Śródmieście;gmina miejska;srodmiescie;dzielnica m.st. Warszawy;ul czerniakowska 128;"=""128""";"=""00-454""";152.0;157.0;96.81528662;157.0;;99.36305732;72.1025641;73.0;158.92142857142858;158.4;118.0;118.0;100.0;118.0;;100.0;77.41025641;78.0;142.62;144.5;173.0;175.0;98.85714286;175.0;;100.0;77.93103448;80.0;150.05;148.6;Tak;Dzieci lub młodzież;1991.09.01;1991.09.01;;741.0;;angielski, francuski, hiszpański, niemiecki, arabski, turecki;Nie;Tak;Tak;ogólnodostępny;
30502;ivloadamamickiewicza;IV LICEUM OGÓLNOKSZTAŁCĄCE IM. ADAMA MICKIEWICZA;publiczna;MAZOWIECKIE;Warszawa;Praga-Południe;gmina miejska;praga poludnie;dzielnica m.st. Warszawy;ul saska 59;"=""59""";"=""03-914""";169.0;171.0;98.83040936;171.0;;99.41520468;75.42105263;77.0;153.2611111111111;158.2;137.0;137.0;100.0;137.0;;100.0;74.8540146;75.0;159.31599999999997;158.85;175.0;175.0;100.0;175.0;;100.0;72.25142857;73.0;162.1125;162.025;Tak;Dzieci lub młodzież;1987.08.01;1987.09.01;;714.0;boiska do siatkówki, boiska do koszykówki, boiska do piłki ręcznej, boiska do piłki nożnej, bieżnie proste, bieżnie okólne, skocznie;angielski, hiszpański, niemiecki, włoski, szwedzki;Nie;Tak;Nie;ogólnodostępny, dwujęzyczny w szkole podstawowej, liceum i technikum;
30629;lxxxviilogenleopoldaokulickiego;LXXXVII LICEUM OGÓLNOKSZTAŁCĄCE IM. GEN. LEOPOLDA OKULICKIEGO;publiczna;MAZOWIECKIE;Warszawa;Praga-Południe;gmina miejska;praga poludnie;dzielnica m.st. Warszawy;ul saska 78;"=""78""";"=""03-914""";27.0;32.0;84.375;32.0;;100.0;65.1875;66.5;;;42.0;49.0;85.71428571;49.0;;100.0;66.51020408;68.0;115.0;115.0;47.0;56.0;83.92857143;57.0;;98.21428571;60.96491228;62.0;123.0;123.0;Tak;Dzieci lub młodzież;1993.07.15;1993.09.01;Zespół szkół i placówek oświatowych;300.0;;angielski, niemiecki;Nie;Tak;Tak;ogólnodostępny;
30690;xvlonarcyzyzmichowskiej;XV LICEUM OGÓLNOKSZTAŁCĄCE Z ODDZIAŁAMI DWUJĘZYCZNYMI IM. NARCYZY ŻMICHOWSKIEJ;publiczna;MAZOWIECKIE;Warszawa;Śródmieście;gmina miejska;srodmiescie;dzielnica m.st. Warszawy;ul klonowa 16;"=""16""";"=""00-591""";125.0;126.0;99.20634921;126.0;;100.0;73.67460317;73.0;163.03;164.53;89.0;89.0;100.0;89.0;1.0;100.0;80.80898876;82.0;148.856;152.8;122.0;122.0;100.0;122.0;;100.0;79.18852459;80.0;159.9466666666667;158.7;Tak;Dzieci lub młodzież;1919.08.31;1919.08.31;;633.0;;angielski, francuski;Nie;Tak;Tak;ogólnodostępny, dwujęzyczny w szkole podstawowej, liceum i technikum;
31063;lxxxiiiloemilianakonopczynskiego;LXXXIII LICEUM OGÓLNOKSZTAŁCĄCE IM. EMILIANA KONOPCZYŃSKIEGO;publiczna;MAZOWIECKIE;Warszawa;Śródmieście;gmina miejska;srodmiescie;dzielnica m.st. Warszawy;ul emiliana konopczynskiego 4;"=""4""";"=""00-335""";134.0;134.0;100.0;134.0;;100.0;67.3880597;67.5;158.6142857142857;160.2;100.0;100.0;100.0;100.0;;100.0;77.18;80.0;145.45;146.025;142.0;142.0;100.0;142.0;;100.0;71.93617021;72.0;157.6375;157.95;Tak;Dzieci lub młodzież;1992.09.01;1995.09.01;Zespół szkół i placówek oświatowych;667.0;;angielski, hiszpański, niemiecki;Nie;Tak;Tak;ogólnodostępny;
31832;iiiloswjanakantego;III LICEUM OGÓLNOKSZTAŁCĄCE IM. ŚW. JANA KANTEGO;publiczna;WIELKOPOLSKIE;Poznań;Poznań;gmina miejska;poznan;miasto;ul strzelecka 10;"=""10""";"=""61-845""";113.0;113.0;100.0;113.0;;100.0;70.59292035;72.0;162.15;165.9;160.0;160.0;100.0;160.0;;100.0;78.21875;80.0;165.6375;166.3;150.0;150.0;100.0;150.0;;100.0;79.27333333;80.0;167.6;165.825;Tak;Dzieci lub młodzież;1920.09.01;1920.09.01;;667.0;boiska uniwersalne/wielozadaniowe;angielski, francuski, hiszpański, niemiecki;Nie;Tak;Nie;ogólnodostępny;
31841;ivlokomisjiedukacjinarodowej;IV LICEUM OGÓLNOKSZTAŁCĄCE IM. KOMISJI EDUKACJI NARODOWEJ;publiczna;WIELKOPOLSKIE;Poznań;Poznań-Jeżyce;gmina miejska;poznan jezyce;delegatura;ul swojska 6;"=""6""";"=""60-592""";139.0;140.0;99.28571429;140.0;2.0;99.28571429;71.99285714;73.0;159.25625;159.85;164.0;164.0;100.0;164.0;1.0;100.0;69.26829268;68.0;152.51875;154.89999999999998;153.0;153.0;100.0;153.0;;100.0;75.73856209;77.0;161.15555555555557;163.1;Tak;Dzieci lub młodzież;1948.09.01;1948.09.01;;684.0;boiska do piłki ręcznej;angielski, francuski, hiszpański, niemiecki, rosyjski;Nie;Tak;Nie;ogólnodostępny;
34199;viiiloadamamickiewicza;VIII LICEUM OGÓLNOKSZTAŁCĄCE IM ADAMA MICKIEWICZA;publiczna;WIELKOPOLSKIE;Poznań;Poznań-Stare Miasto;gmina miejska;poznan stare miasto;delegatura;ul hipolita cegielskiego 1;"=""1""";"=""61-862""";226.0;226.0;100.0;226.0;1.0;100.0;72.36283186;73.0;155.10833333333332;157.95;166.0;166.0;100.0;166.0;1.0;100.0;78.01204819;79.0;163.3625;163.75;167.0;167.0;100.0;167.0;3.0;100.0;78.78443114;80.0;169.29285714285714;168.55;Tak;Dzieci lub młodzież;1923.09.01;1923.09.01;;798.0;skocznie, boiska uniwersalne/wielozadaniowe;angielski, francuski, niemiecki, rosyjski;Nie;Tak;Tak;ogólnodostępny;
34505;xcivlogenstanislawamaczka;XCIV LICEUM OGÓLNOKSZTAŁCĄCE IM. GEN. STANISŁAWA MACZKA;publiczna;MAZOWIECKIE;Warszawa;Bielany;gmina miejska;bielany;dzielnica m.st. Warszawy;ul gwiazdzista 35;"=""35""";"=""01-651""";170.0;170.0;100.0;170.0;;100.0;71.17058824;72.0;161.0;160.64999999999998;160.0;160.0;100.0;160.0;;100.0;76.50943396;78.0;148.6;152.4;189.0;189.0;100.0;189.0;;100.0;79.2962963;80.0;157.43;159.425;Tak;Dzieci lub młodzież;1995.05.06;1995.09.03;;863.0;boiska do siatkówki, boiska do koszykówki, bieżnie proste, skocznie, inne urządzenia sportowe, boiska uniwersalne/wielozadaniowe;angielski, hiszpański, niemiecki, włoski;Nie;Tak;Tak;ogólnodostępny;
34506;cxxiiloignacegodomeyki;CXXII LICEUM OGÓLNOKSZTAŁCĄCE IM. IGNACEGO DOMEYKI;publiczna;MAZOWIECKIE;Warszawa;Bielany;gmina miejska;bielany;dzielnica m.st. Warszawy;ul leopolda staffa 3 5;"=""3/5""";"=""01-891""";182.0;182.0;100.0;182.0;;100.0;79.58241758;80.0;172.0;172.0;116.0;116.0;100.0;116.0;;100.0;74.1637931;74.0;175.3625;174.775;144.0;144.0;100.0;144.0;;100.0;80.54166667;82.0;172.54166666666666;171.275;Tak;Dzieci lub młodzież;1999.08.27;1999.09.01;;689.0;boiska do koszykówki, bieżnie okólne, skocznie, inne urządzenia sportowe, boiska uniwersalne/wielozadaniowe;angielski, hiszpański, niemiecki;Nie;Tak;Tak;ogólnodostępny;
34510;xxxixlolotnictwapolskiego;XXXIX LICEUM OGÓLNOKSZTAŁCĄCE IM. LOTNICTWA POLSKIEGO;publiczna;MAZOWIECKIE;Warszawa;Bielany;gmina miejska;bielany;dzielnica m.st. Warszawy;ul bogumila zuga 16;"=""16""";"=""01-806""";84.0;88.0;95.45454545;89.0;;100.0;68.50561798;70.0;124.01666666666667;123.275;82.0;93.0;88.17204301;93.0;;98.92473118;62.10869565;63.0;106.26666666666667;109.7;109.0;122.0;89.3442623;123.0;;97.54098361;61.02439024;62.0;129.8625;129.925;Tak;Dzieci lub młodzież;1963.09.01;1963.09.01;;502.0;boiska do siatkówki, boiska do koszykówki, boiska do piłki ręcznej, bieżnie proste, skocznie;angielski, hiszpański, niemiecki, rosyjski;Nie;Tak;Tak;ogólnodostępny;
34512;xlilojoachimalelewela;XLI LICEUM OGÓLNOKSZTAŁCĄCE IM. JOACHIMA LELEWELA;publiczna;MAZOWIECKIE;Warszawa;Bielany;gmina miejska;bielany;dzielnica m.st. Warszawy;ul kiwerska 3;"=""3""";"=""01-682""";206.0;207.0;99.51690821;207.0;1.0;99.51690821;77.71219512;80.0;162.88444444444445;168.15;198.0;199.0;99.49748744;199.0;2.0;99.49748744;76.08040201;78.0;165.878;168.25;210.0;210.0;100.0;210.0;;100.0;84.77990431;87.0;169.91111111111113;170.75;Tak;Dzieci lub młodzież;1920.09.01;1920.09.01;;839.0;boiska do siatkówki, boiska do koszykówki, boiska do piłki ręcznej, bieżnie proste, skocznie, inne urządzenia sportowe;angielski, francuski, hiszpański, niemiecki;Nie;Tak;Nie;ogólnodostępny, dwujęzyczny w szkole podstawowej, liceum i technikum;
34513;liilowladyslawastanislawareymonta;LII LICEUM OGÓLNOKSZTAŁCĄCE IM. WŁADYSŁAWA STANISŁAWA REYMONTA;publiczna;MAZOWIECKIE;Warszawa;Bielany;gmina miejska;bielany;dzielnica m.st. Warszawy;ul stefana zeromskiego 81;"=""81""";"=""01-882""";110.0;113.0;97.34513274;113.0;;100.0;56.5840708;55.0;141.35;142.4;85.0;85.0;100.0;85.0;;100.0;63.23529412;62.0;131.525;131.525;108.0;110.0;98.18181818;110.0;;100.0;67.29090909;67.0;144.33333333333334;144.0;Tak;Dzieci lub młodzież;1949.09.01;1949.09.01;Zespół szkół i placówek oświatowych;497.0;;angielski, hiszpański, niemiecki;Nie;Tak;Tak;ogólnodostępny;
34621;xlvilostefanaczarnieckiegowwarszawie;XLVI LICEUM OGÓLNOKSZTAŁCĄCE Z ODDZIAŁAMI DWUJĘZYCZNYMI IM. STEFANA CZARNIECKIEGO W WARSZAWIE;publiczna;MAZOWIECKIE;Warszawa;Targówek;gmina miejska;targowek;dzielnica m.st. Warszawy;ul zurominska 4;"=""4""";"=""03-341""";151.0;155.0;97.41935484;155.0;;98.70967742;67.61290323;70.0;151.0625;141.85;163.0;166.0;98.19277108;166.0;;100.0;68.63030303;70.0;132.23333333333335;133.3;165.0;168.0;98.21428571;168.0;;99.4047619;66.51785714;67.0;144.53333333333333;141.45;Tak;Dzieci lub młodzież;1960.09.01;1960.09.01;;906.0;;angielski, francuski, hiszpański, niemiecki, rosyjski, włoski;Nie;Tak;Tak;ogólnodostępny, dwujęzyczny w szkole podstawowej, liceum i technikum;
34665;lxxxviiilomichalakonarskiego;LXXXVIII LICEUM OGÓLNOKSZTAŁCĄCE IM. MICHAŁA KONARSKIEGO;publiczna;MAZOWIECKIE;Warszawa;Wola;gmina miejska;wola;dzielnica m.st. Warszawy;ul okopowa 55a;"=""55a""";"=""01-043""";45.0;53.0;84.90566038;53.0;;94.33962264;59.49056604;60.0;118.025;123.025;51.0;66.0;77.27272727;66.0;;95.45454545;57.86363636;60.0;74.16666666666667;85.25;56.0;58.0;96.55172414;59.0;;100.0;65.38983051;63.0;68.23333333333333;57.0;Tak;Dzieci lub młodzież;2004.09.01;2004.09.01;Zespół szkół i placówek oświatowych;321.0;;angielski, niemiecki;Nie;Tak;Tak;ogólnodostępny, profil mundurowy;
38949;ilojuliuszaslowackiego;I LICEUM OGÓLNOKSZTAŁCĄCE IM. JULIUSZA SŁOWACKIEGO;publiczna;ŚLĄSKIE;Częstochowa;Częstochowa;gmina miejska;czestochowa;miasto;al aleja tadeusza kosciuszki 8;"=""8""";"=""42-202""";134.0;135.0;99.25925926;135.0;;100.0;79.68148148;82.0;;;142.0;142.0;100.0;142.0;;100.0;76.08450704;80.0;131.9375;132.425;142.0;142.0;100.0;142.0;;100.0;71.0915493;73.0;;;Tak;Dzieci lub młodzież;1977.01.01;1977.01.01;;644.0;;angielski, łacina, niemiecki, rosyjski, włoski;Nie;Tak;Tak;ogólnodostępny;
39099;xxxiiilodwujezycznemikolajakopernika;XXXIII LICEUM OGÓLNOKSZTAŁCĄCE DWUJĘZYCZNE IM. MIKOŁAJA KOPERNIKA;publiczna;MAZOWIECKIE;Warszawa;Wola;gmina miejska;wola;dzielnica m.st. Warszawy;ul jozefa bema 76;"=""76""";"=""01-225""";130.0;130.0;100.0;130.0;1.0;100.0;77.75384615;78.0;188.56428571428572;188.16;120.0;120.0;100.0;120.0;;100.0;81.73333333;82.0;188.78571428571428;192.29;116.0;116.0;100.0;116.0;;100.0;84.82758621;87.0;187.54;187.45;Tak;Dzieci lub młodzież;1949.09.01;1949.09.01;;856.0;;angielski, francuski, hiszpański, niemiecki;Nie;Tak;Tak;międzynarodowy, dwujęzyczny w szkole podstawowej, liceum i technikum;
39647;xvilostefaniisempolowskiej;XVI LICEUM OGÓLNOKSZTAŁCĄCE Z ODDZIAŁAMI DWUJĘZYCZNYMI IM. STEFANII SEMPOŁOWSKIEJ;publiczna;MAZOWIECKIE;Warszawa;Żoliborz;gmina miejska;zoliborz;dzielnica m.st. Warszawy;ul ks jerzego popieluszki 5;"=""5""";"=""01-786""";115.0;115.0;100.0;115.0;;100.0;76.42608696;77.0;164.538;165.7;127.0;127.0;100.0;127.0;;100.0;81.72440945;83.0;158.2125;159.175;117.0;117.0;100.0;117.0;;100.0;79.2991453;82.0;156.07857142857142;154.4;Tak;Dzieci lub młodzież;1935.09.01;1935.09.09;;593.0;boiska do piłki ręcznej, boiska do piłki nożnej, bieżnie proste, bieżnie okólne, skocznie;angielski, francuski, hiszpański;Nie;Tak;Tak;ogólnodostępny, dwujęzyczny w szkole podstawowej, liceum i technikum;
39649;lxivlostanislawaignacegowitkiewiczawitkacego;"LXIV LICEUM OGÓLNOKSZTAŁCĄCE IM. STANISŁAWA IGNACEGO WITKIEWICZA ""WITKACEGO""";publiczna;MAZOWIECKIE;Warszawa;Żoliborz;gmina miejska;zoliborz;dzielnica m.st. Warszawy;ul elblaska 51;"=""51""";"=""01-737""";119.0;119.0;100.0;119.0;;100.0;77.8907563;78.0;177.3;177.075;108.0;108.0;100.0;108.0;1.0;100.0;82.61111111;85.0;175.375;174.65;118.0;118.0;100.0;118.0;3.0;100.0;78.44067797;79.0;176.1875;175.375;Tak;Dzieci lub młodzież;1990.07.06;1990.09.01;;504.0;bieżnie proste, boiska uniwersalne/wielozadaniowe;angielski, francuski, hiszpański, niemiecki, rosyjski;Nie;Tak;Tak;o charakterze eksperymentalnym;
40944;iiloromualdatraugutta;II LICEUM OGÓLNOKSZTAŁCĄCE IM. ROMUALDA TRAUGUTTA;publiczna;ŚLĄSKIE;Częstochowa;Częstochowa;gmina miejska;czestochowa;miasto;ul jana kilinskiego 62;"=""62""";"=""42-218""";99.0;99.0;100.0;99.0;;100.0;75.71717172;75.0;;;118.0;119.0;99.15966387;119.0;;99.15966387;63.43697479;65.0;132.18;126.3;117.0;118.0;99.15254237;118.0;;100.0;68.00847458;67.0;;;Tak;Dzieci lub młodzież;1977.01.01;1977.01.01;;643.0;boiska uniwersalne/wielozadaniowe;angielski, francuski, hiszpański, niemiecki, rosyjski, włoski;Nie;Tak;Tak;ogólnodostępny;
40982;viiilowladyslawaiv;VIII LICEUM OGÓLNOKSZTAŁCĄCE IM. WŁADYSŁAWA IV;publiczna;MAZOWIECKIE;Warszawa;Praga-Północ;gmina miejska;praga polnoc;dzielnica m.st. Warszawy;ul jagiellonska 38;"=""38""";"=""03-719""";126.0;126.0;100.0;126.0;;100.0;81.47619048;82.0;174.1;173.3;148.0;148.0;100.0;148.0;1.0;100.0;78.00680272;80.0;173.60999999999999;175.35;140.0;140.0;100.0;140.0;;100.0;80.72142857;82.0;173.1;172.6;Tak;Dzieci lub młodzież;1915.09.13;1915.09.13;;622.0;boiska uniwersalne/wielozadaniowe;angielski;Nie;Tak;Tak;ogólnodostępny;
